Question,GT Answer,"open-squad-short_got-3+demos-sa-knn+cx+t5-nli-ec+ci+[0.3,0.6,0.1]_gpt-3.5-turbo-1106_google","open-squad-short_got-3+demos-sa+cx+t5-nli-ec+ci+[0.3,0.6,0.1]_gpt-3.5-turbo-1106_google",open-squad-short_vanilla_gpt-3.5-turbo-1106_google,open-squad-short_retrieve_then_read_sc_gpt-3.5-turbo-1106_google,open-squad-short_multihop_gpt-3.5-turbo-1106_google,open-squad-short_dsp+sample_gpt-3.5-turbo-1106_google,open-squad-short_dsp+knn_gpt-3.5-turbo-1106_google
Who did internet2 partner with,"['The Internet2 community, in partnership with Qwest', 'Qwest', 'Qwest']","Amazon Web Services, Google Cloud Platform, and Microsoft Azure",Key organizations,NASA and the National Science Foundation,"key organizations, global research networks, state and regional research and education networks, Qwest",Amazon Web Services,"key organizations, security, trust, identity experts, cloud services, regional and state network providers",Amazon Web Services
How do cestids swim?,"['by undulating their bodies as well as by the beating of their comb-rows.', 'undulating their bodies', 'by undulating their bodies as well as by the beating of their comb-rows']",Ciliary gliding,They do not swim,with undulating movements,as free-swimming oncosphere larvae,with a ciliated epithelium,with a swimming coracidium stage,with a swimming coracidium stage
What causes rock extension?,"['normal faulting and through the ductile stretching and thinning', 'normal faulting', 'normal faulting and through the ductile stretching and thinning']",Tensional forces,Tensional stresses,tectonic forces,Tensional forces,Tensional forces,Tensional forces,Tensional forces
What is retrograde signaling?,"['signals from the chloroplast that regulate gene expression in the nucleus', 'signals from the chloroplast that regulate gene expression', 'signals from the chloroplast that regulate gene expression in the nucleus']",Signal travels backwards from target to source,Signal travels backwards,signaling that travels in the opposite direction from the usual flow of information,The process where a signal travels backwards from a target source to its original source.,Postsynaptic production of a signal acting on the presynaptic neuron,A process where a signal travels backward from a target source to its original source.,a process in biology where a signal travels backward from a target source to its original source
What does chloroplastidan mean?,"['green chloroplast', 'green chloroplast lineage', 'green chloroplast lineage']",Green algae and land plants,Various green algae and land plants,It refers to a group of algae and land plants.,related to chloroplasts,presence of chloroplasts,Chloroplastida means a group of organisms that includes green algae and land plants.,Chloroplastida means a group of organisms that includes green algae and land plants.
What is tertiary education?,"['universities and/or TAFE colleges', 'universities and/or TAFE colleges', 'universities and/or TAFE colleges']",Post-secondary education beyond high school,Post-secondary education,higher education beyond secondary school,post-secondary education,Education beyond secondary school,post-secondary education beyond high school,post-secondary education
Who bought the rights?,"['Enrique Pérez de Guzmán', 'Enrique Pérez de Guzmán', 'Enrique Pérez de Guzmán']",Big Time Rush,Big Time Rush,Disney bought the rights,Hipgnosis Songs Capital,Current owners,"Bought The Rights, LLC",Big Time Rush
Where was Luther born?,"['Eisleben, Saxony', 'Eisleben, Saxony', 'Eisleben, Saxony']","Eisleben, Germany","Eisleben, Saxony","Eisleben, Germany","Eisleben, Germany",Eisleben,"Eisleben, Germany","Eisleben, Germany"
What did Tesla write?,"['books and articles', 'a number of books and articles', 'a number of books and articles']",Books and articles,"""The Problem of Increasing Human Energy""",AC and DC systems,My Inventions: The Autobiography of Nikola Tesla; The Fantastic Inventions of Nikola Tesla; The Tesla Papers,Books and articles,books and articles,Books and articles
Which company owns ABC?,"['The Walt Disney Company', 'The Walt Disney Company', 'The Walt Disney Company']",The Walt Disney Company,The Walt Disney Company,The Walt Disney Company,The Walt Disney Company,The Walt Disney Company,The Walt Disney Company,The Walt Disney Company
What are frets?,"['helicoid stromal thylakoids', 'helicoid stromal thylakoids', 'helicoid stromal thylakoids']",Metal strips on a neck,Thin strips on a stringed instrument,metal strips on a guitar,Metal strips on a guitar's fretboard.,Thin strips of metal embedded in the neck of a guitar,Strips of metal on a guitar's fretboard,Strips of metal on a guitar's fretboard
Who mentored Buyantu?,"['Li Meng', 'Li Meng', 'Li Meng']",Li Meng,Li Meng,Temür Khan,Li Meng,Li Meng,Li Meng,Li Meng
Which organisms have chloroplasts?,"['plants and algae', 'plants and algae', 'plants and algae.']",Plants and algae,Plants and photosynthetic algae,plants and algae,"plants, algae, and some protists",Plants and algae,plants and photosynthetic algae,"plants, algae, and some species of amoeba"
Where do Ctenophora live?,"['marine waters worldwide.', 'marine waters worldwide', 'marine waters']","Almost all ocean regions, particularly in surface waters near shores",Marine habitats,in marine environments,in most marine environments,marine habitats,"marine habitats, almost all ocean regions, particularly in surface waters near shores","marine habitats, almost all ocean regions, particularly in surface waters near shores"
What shape are pyrenoids?,"['roughly spherical', 'roughly spherical', 'spherical']",Various shapes,"Spheres, plates, rods",round or oval,"spheres, plates, rods",spheroidal,"spheres, plates, rods","spheres, plates, rods"
Who had mathmatical insite?,"['Sir Isaac Newton', 'Sir Isaac Newton', 'Sir Isaac Newton', 'Sir Isaac Newton', 'Sir Isaac Newton', 'Sir Isaac Newton']",John Horton Conway,John Horton Conway,Isaac Newton,"educators, researchers, and students",Cantor,Math Insight,Euclid and Archimedes
How are packets normally forwarded,"['by intermediate network nodes asynchronously using first-in, first-out buffering, but may be forwarded according to some scheduling discipline for fair queuing', 'intermediate network nodes asynchronously using first-in, first-out buffering', 'asynchronously']",Through the network layer,between a source interface and a destination interface,by routers,by nodes in a computer network,Between source and destination interfaces,By the IP forwarding module.,By the IP forwarding module
Where was Luther buried?,"['in the Castle Church', 'Castle Church in Wittenberg', 'Castle Church in Wittenberg,']",Castle Church at Wittenberg,"Eisleben, Germany","Castle Church in Wittenberg, Germany",Castle Church at Wittenberg,Castle Church at Wittenberg,Castle Church at Wittenberg,"Castle Church, Wittenberg"
What river separates Jacksonville?,"['The St. Johns River', 'St. Johns River', 'St. Johns River']",St. Johns River,St. Johns River,St. Johns River,St. Johns River,St. Johns River,St. Johns River,St. Johns River
What delivery message was used ,"['by store and forward switching', 'packets', 'store and forward switching']",Delivered,Delivered,Pony Express,Delivered,text message,SMS delivery message,SMS delivery message templates
What are construction managers?,"['firms engaged in managing construction projects without assuming direct financial responsibility for completion of the construction project', 'firms engaged in managing construction projects', '(firms engaged in managing construction projects without assuming direct financial responsibility for completion of the construction project)']",Project supervisors,Supervisors of construction projects,oversee building projects,oversee construction projects,oversee construction projects,"They are responsible for planning, coordinating, budgeting, and supervising construction projects from start to finish.",Key leaders in infrastructure development
How tall was Tesla?,"['6 feet 2 inches', '6 feet 2 inches', '6 feet 2 inches (1.88 m)']",6 feet 2 inches,6 feet 2 inches,6 feet 2 inches,6 feet 2 inches,6 feet 2 inches,6 feet 2 inches,6 feet 2 inches
What is Vision 2030?,"['an economic development programme it hopes will put the country in the same league as the Asian Economic Tigers by the year 2030', 'economic development programme', 'an economic development programme']","Plan for Saudi Arabia built around three themes: a vibrant society, a thriving economy, and an ambitious nation","Saudi Arabia's ambitious roadmap for economic diversification, global engagement, and enhanced quality of life.",Saudi Arabia's plan to reduce its dependence on oil and diversify its economy.,"Saudi Arabia's ambitious roadmap for economic diversification, global engagement, and enhanced quality of life.",A plan for the future of Saudi Arabia,A plan for economic diversification and enhanced quality of life in Saudi Arabia built around three primary themes.,"a plan for economic diversification, global engagement, and enhanced quality of life in Saudi Arabia built around three primary themes."
What is a stromule?,"['stroma-containing tubule', 'stroma-containing tubule', 'stroma-containing tubule']",Plastid stroma-filled tubules,Plastid stroma-filled tubules,a tubular extension of a plastid,a microscopic structure in plant cells,thin tubular extensions of the plastid compartment surrounded by the envelope membrane,microscopic structures in plant cells,plant cell structure
When did Torchwood premier?,"['22 October 2006', '22 October 2006', '22 October 2006']","October 22, 2006","October 22, 2006",2006,"October 22, 2006","October 22, 2006","October 22, 2006","October 22, 2006"
Who was Frédéric Chopin?,"['Famous musicians', 'musicians', 'Famous musicians']",Polish French composer and pianist,Polish composer and pianist,a Polish composer and virtuoso pianist,Polish composer and virtuoso pianist,Polish-French composer and pianist,Polish French composer and pianist,Polish French composer and pianist
What did Warsz own?,"['a village', 'village']",Several private independent districts,Twitch streamer,a large estate in the village of Warszowice,Twitch account,Warzone player with $200k earned,content creator and streamer,"personal possessions such as clothing, jewelry, and personal property"
What was report P-2626,"['a general architecture for a large-scale, distributed, survivable communications network', 'a general architecture for a large-scale, distributed, survivable communications network', 'briefing B-265']",O2 Sensor Pumping Current Trim/Open Bank 1 Sensor 1,O2 Sensor Pumping Current Trim/Open Bank 1 Sensor 1,a report on the use of nuclear weapons,O2 sensor pumping current trim circuit/open bank 1 sensor 1,A trouble code for a bad O2 sensor,Report P-2626 is related to building digital communication networks using links with less than perfect reliability.,Distributed communications networks
Who conceptualized the piston?,"['Papin', 'Papin', 'Papin', 'Papin']",Denis Papin,Denis Papin,Herón of Alexandria,Denis Papin,Father Eugenio Barsanti and Felice Matteucci,Denis Papin,John Ramsbottom
Was the plan formalized?,"['The plan that the delegates agreed to was never ratified by the colonial legislatures nor approved of by the crown', 'was never ratified', 'never ratified', 'never ratified', 'The plan that the delegates agreed to was never ratified']",Yes,Yes,"Yes, in 2015.",Yes,Yes,Yes,Yes
Who attends Loreto Normanhurst?,"['girls', 'girls', 'girls']",Girls from Years 5-12,Students from rural NSW,Girls from Kindergarten to Year 12 attend Loreto Normanhurst.,Girls in Years 5-12 attend Loreto Normanhurst.,"Approximately 1100 girls from Year 5 to Year 12, including around 170 boarding students.","Girls from Year 5 to Year 12, including boarding students.",Girls in Years 5-12
What is Nexus?,"['the Tyne and Wear Passenger Transport Executive.', 'the Tyne and Wear Passenger Transport Executive', 'Passenger Transport Executive']",Convergence of disruptive forces,A means of connection; tie; link.,a brand of smartphones and tablets,"Connection, link",level of minimum contacts in a state,connection between a state and a business,level of connection between a taxing jurisdiction and an entity
What was Warner Sinback,"[""a data network based on this voice-phone network was designed to connect GE's four computer sales and service centers"", 'a data network', 'a data network']",A person who recommended selling time-sharing services,Developer,an American author and journalist,a person,involved in the development of a time-sharing operating system,Involved in the creation of General Electric Information Services and the development of a time-sharing operating system.,involved in the creation of General Electric Information Services and the development of a time-sharing operating system
WHat does UserDatagram Protocol gaurentee,"['In the virtual call system, the network guarantees sequenced delivery of data to the host', 'sequenced delivery of data to the host', 'sequenced delivery of data']",No guarantees for message delivery,Data integrity,no guarantee of delivery or duplicate protection,no guarantees for message delivery,UDP does not guarantee anything,no guarantee of data delivery,no data delivery guarantee
What does paramylon store?,"['Starch', 'Starch', 'Starch']",Reserve food,Food,energy,photosynthate,glucose polymers,photosynthate,photosynthate
What was apolitical Islam?,"['a historical fluke', 'political Islam', 'historical fluke']",A modern phenomenon,A modern phenomenon,a movement in the 20th century,a modern phenomenon that seeks to use religion to shape the political system,Basis for political identity and action,A modern phenomenon that seeks to use religion to shape the political system,Any interpretation of Islam as a source of political identity and action
Telnet was sold to ,"['Telenet was incorporated in 1973 and started operations in 1975. It went public in 1979 and was then sold to GTE', 'GTE', 'GTE']",Vivacom,Vivacom,Microsoft,Vivacom,Vivacom,Vivacom,Vivacom
Who did Luther banish?,"['Zwickau prophets', 'Zwickau prophets', 'Zwickau prophets']",Martin Luther,Pope Leo X,Anabaptists,Jews,Zwickau prophets,someone from Saxony and attempted to do the same in Brandenburg,Someone from Saxony and attempted to do the same in Brandenburg.
What does Obersee mean?,"['upper lake', 'upper lake', '(""upper lake""', 'upper lake']",Upper Lake,Upper Lake,Upper Lake,Upper Lake,Upper Lake,"""Upper Lake""",Upper Lake
What is a statocyst?,"['a balance sensor', 'a balance sensor consisting of a statolith', 'a balance sensor consisting of a statolith']",A balance sensory receptor,Balance sensory receptor,a balance organ in invertebrates,balance sensory receptor,balance sensory receptor,A balance sensory receptor in aquatic invertebrates.,balance sensory receptor
What happened in 1901?,"['Marconi successfully transmitted the letter S from England to Newfoundland', 'Marconi successfully transmitted the letter S from England to Newfoundland', 'Marconi successfully transmitted the letter S from England to Newfoundland']",President William McKinley was assassinated.,McKinley was shot,The first Nobel Prizes were awarded.,"McKinley was shot and killed, and Theodore Roosevelt became president.","Various events occurred in 1901, including the shooting of US President William McKinley, the end of the Boxer Rebellion in China, and the invention of the spiral hairpin and prototype motorcycle.",McKinley was assassinated and Queen Victoria died,President William McKinley was assassinated.
Who were the Semuren?,"['allied groups from Central Asia and the western end of the empire', 'various allied groups from Central Asia and the western end of the empire', 'various allied groups']",Persons with special status,Persons with special status,a noble family in France,Persons with special status in the Yuan dynasty,a social class in the Yuan dynasty,a social class in China during the Yuan dynasty,Persons with special status in the Yuan dynasty
Who directed Stormy Monday?,"['Mike Figgis', 'Mike Figgis', 'Mike Figgis']",Mike Figgis,Mike Figgis,Mike Figgis,Mike Figgis,Mike Figgis,Mike Figgis,Mike Figgis
What is the NASUWT?,"['trade unions', 'trade unions', 'trade unions']",National Association of Schoolmasters/Union of Women Teachers,Teachers' Union,National Association of Schoolmasters Union of Women Teachers,a trade union representing teachers in the UK,A trade union representing teachers in the United Kingdom,a trade union representing teachers throughout the United Kingdom,a trade union representing teachers throughout the United Kingdom
Who made Ralph earl?,"['Edward the Confessor', 'Edward the Confessor', 'Edward the Confessor']",Ralph Earl,Ralph Earl,Ralph Earl was an American painter.,Ralph Earl,Self-taught,Benjamin West and Joshua Reynolds,Ralph Earl
What tribes supported British?,"['Iroquois Six Nations, and also by the Cherokee', 'Iroquois Six Nations, and also by the Cherokee', 'Iroquois Six Nations, and also by the Cherokee', 'Iroquois', 'the Iroquois Six Nations']","Fox, Chickamauga, Iroquois, Kickapoo, Mascouten, Mohawk, Ojibway, Piankeshaw, Potawatomi, Sauk and Shawnee","Fox, Chickamauga, Iroquois, Kickapoo, Mascouten, Mohawk, Ojibway, Piankeshaw, Potawatomi, Sauk, Shawnee",Iroquois and Cherokee,"Mohawk, Fox, Chickamauga, Iroquois, Kickapoo, Mascouten, Ojibway, Piankeshaw, Potawatomi, Sauk, Shawnee","Cherokees, Creeks, Iroquois, Mohawk, Oneida, Tuscarora","Cherokees, Creeks, most Iroquois nations, Fox, Chickamauga, Kickapoo, Mohawk, Ojibway, Potawatomi, Shawnee","Cherokees, Creeks, and most Iroquois nations"
What do pyrenoids store?,"['starch', 'starch', 'starch']",Starch and occasionally proteins,Starch and occasionally proteins,starch,Starch and occasionally proteins,starch,Starch,starch
Who did Emma Marry?,"['King Ethelred II', 'Ethelred II', 'King Ethelred II']",Mr. Knightley,Mr. Knightley,King Ethelred II of England,Mr. Knightley,Will Schuester,Mr. Knightley,Mr. Knightley
Who did he fire?,"['secretary', 'a secretary', 'a secretary']",.44 Magnum,Harry Callahan,Secretary of State Rex Tillerson,six shots,Sam Altman,a bank robber,bank robber
Who wrote The Mutants?,"['Terry Nation', 'Terry Nation', 'Terry Nation']",Josh Boone and Knate Gwaltney,Josh Boone,Bernard Stiegler,Bob Baker and Dave Martin,"M. Gerald Neuffer, Edward H. Coe, Susan R. Wessler",Kris Neville,Susan Wessler
Where was war fought?,"['primarily along the frontiers between New France and the British colonies', 'between New France and the British colonies', 'frontiers between New France and the British colonies', 'along the frontiers', 'Virginia in the South to Nova Scotia in the North']","Eastern Asia, the Pacific Ocean, the Indian Ocean",Europe and the Pacific,"in Europe, Asia, and Africa","Europe, the Middle East, Africa, the Pacific, parts of Asia, South-central United States, northern Mexico",Eastern part of the country,"Southern United States, Europe, Middle East, Africa, Pacific, Asia","Europe, the Middle East, Africa, the Pacific, Asia, and the southern United States"
What surrounds chloroplasts?,"['two innermost lipid-bilayer membranes', 'phagocytic vacuole', 'lipid-bilayer membranes']",chloroplast envelope,Chloroplast envelope,double membrane,chloroplast envelope,chloroplast envelope and thylakoid membrane,chloroplast envelope,chloroplast envelope
Who was Count of Melfi,"['William Iron Arm', 'William Iron Arm', 'William Iron Arm']",Niccolò Acciaioli,Niccolò Acciaioli,Robert Guiscard,William of Hauteville,William of Hauteville,The Count of Melfi was a member of the House of Hauteville.,The Count of Melfi was a Norman ruler and conqueror.
What is structural geology?,"['the study of positions of rock units and their deformation', 'study of positions of rock units and their deformation', 'the study of positions of rock units and their deformation']",Study of rock distribution and deformation,Study of rock distribution and deformation,the study of the three-dimensional distribution of rock units and their deformation patterns,Study of rock deformation,study of the architecture of rocks as related to deformation,"study of the form, arrangement, and internal structure of rocks","study of the form, arrangement, and internal structure of rocks"
When was vetting introduced?,"['2006', '2006', '2006']",1891,January 2017,1947,early 2000s,1930s,1860s,1860s
What is an anda?,"['sworn brother or blood brother', 'sworn brother', 'sworn brother or blood brother)']",contains data for generic drug approval,A request to the FDA,a type of Indian egg curry dish,regulatory submission for generic drugs,Spanish word with various meanings,"""You"" in Indonesian, ""to operate"" in Spanish, and an abbreviation for Abbreviated New Drug Application (ANDA)","surprise, disbelief, rejection, admiration, emphasis, and irony in colloquial Spanish; also an abbreviation for Abbreviated New Drug Application (ANDA)"
What do apicoplasts synthesize?,"['fatty acids, isopentenyl pyrophosphate, iron-sulfur clusters', 'fatty acids, isopentenyl pyrophosphate, iron-sulfur clusters', 'fatty acids, isopentenyl pyrophosphate, iron-sulfur clusters']",Fatty acids,Isoprenoid precursors and fatty acids,fatty acids and isoprenoids,fatty acids,lipids,lipids and isoprenoid precursors,Lipids and isoprenoid precursors
What are apicoplasts missing?,"['photosynthetic pigments or true thylakoids', 'photosynthetic function', 'all photosynthetic function']",The capability for photosynthesis,Photosynthetic ability,a cell wall,Photosynthesis,ability to convert light into energy,photosynthesis,photosynthesis and pigment-loaded thylakoid membranes
What can amyloplasts become?,"['chromoplasts', 'chromoplasts', 'chromoplasts']",Chloroplasts,Chloroplasts,chloroplasts,chloroplasts,chromoplasts,chloroplasts,chloroplasts
What are colloblasts?,"['specialized mushroom-shaped cells in the outer layer of the epidermis', 'specialized mushroom-shaped cells in the outer layer of the epidermis', 'specialized mushroom-shaped cells in the outer layer of the epidermis']",Structures used to capture prey,Structures used to capture prey,adhesive cells in ctenophores,adhesive cells in ctenophores,specialized cells in ctenophores,Sticky cells in ctenophores,Sticky cells in ctenophores.
What does zhèng mean?,"['""right"", ""just"", or ""true""', 'right', 'right"", ""just"", or ""true"",']",Correct,upright or correct,correct/right/proper/proficient,correct,upright or correct,"upright, exactly, in good order, whole, complete, entire, correct, honest, and standard","correct, upright, honest, standard"
When was the Holocene?,"['11,700 years ago', '~11,700 years ago', '~11,700 years ago']","approximately 9,700 years before the Common Era (BCE)",0.012 million years ago,"11,700 years ago","11,700 years ago","11,700 years before 2000 CE","approximately 11,700 years ago","Approximately 11,700 years ago"
When was Montreal captured?,"['1760', '1760', '1760', '1760', '1760']","September 8, 1760","November 13, 1775",1760,"September 8, 1760","September 6, 1760","November 13, 1775","November 13, 1775"
What did this concept contradict ,"['This concept contrasted and contradicted the theretofore established principles of pre-allocation of network bandwidth', 'theretofore established principles of pre-allocation of network bandwidth', 'principles of pre-allocation of network bandwidth']",Itself,Reality,the theory of divine right of kings,previously established theory,Consistency,other ideas or principles,other ideas or principles
How large are Plastoglobuli?,"['45–60 nanometers across', '45–60 nanometers across', '45–60 nanometers across']",80-120 nm,80-120 nm,100-500 nanometers,Between 60 nm and 4000 nm,80-120 nm,30 nm to several micrometers,100-200 nm
What are cestida called?,"['belt animals', 'belt animals', '""belt animals""']",Tapeworms,Tapeworms,comb jellies,tapeworms,ctenophores,tapeworms,tapeworms
What entity owns V/Line?,"['Victorian Government', 'the Victorian Government', 'Victorian Government']",The government,V/Line Corporation,"The Government of Victoria, Australia",V/Line is owned by the government.,Victorian state government,V/Line Corporation,Government-owned corporation
What does NADPH store?,"['energy', 'energy', 'energy']",Energy,Energy,energy,energy,electrons and protons,sugars,reducing agents
What is Psalm 31:5?,"['prayer of the dying', 'the common prayer of the dying', 'common prayer of the dying.']","""Into your hand I commit my spirit; you have redeemed me, O LORD, faithful God.""","""Into your hands I commit my spirit""","Into your hands I commit my spirit; deliver me, Lord, my faithful God.",A verse from the book of Psalms in the Bible,A verse from the book of Psalms in the Bible.,Entrusting one's spirit to the Lord,A verse from the Bible expressing trust and reliance on God
What are chares?,"['Narrow alleys', 'Narrow alleys', 'Narrow alleys']",Narrow medieval streets or alleys,Masculine name,ancient Greek coins,Positive and negative charges,"Chares can refer to a masculine name meaning ""grace"" or ""kindness"" in Greek, or it can also mean ""chore"" or ""household chore"" in English.",Chares can refer to a masculine name or a narrow medieval street.,chores or small jobs
Who wrote the eulogy?,"['Louis Adamic', 'Louis Adamic', 'Slovene-American author Louis Adamic']",Jackie Bailey,Maynard James Keenan,William Shakespeare wrote the eulogy for Julius Caesar.,Young Thug & Gunna,"close family member, friend, or minister",immediate family member or loved one,Jackie Bailey
