Question,GT Answer,"open-squad-short_got-3+demos-sa-knn+cx+t5-nli-ec+ci+[0.3,0.6,0.1]_gpt-3.5-turbo-1106_google","open-squad-short_got-3+demos-sa+cx+t5-nli-ec+ci+[0.3,0.6,0.1]_gpt-3.5-turbo-1106_google",open-squad-short_vanilla_gpt-3.5-turbo-1106_google,open-squad-short_retrieve_then_read_sc_gpt-3.5-turbo-1106_google,open-squad-short_multihop_gpt-3.5-turbo-1106_google,open-squad-short_dsp+sample_gpt-3.5-turbo-1106_google,open-squad-short_dsp+knn_gpt-3.5-turbo-1106_google
What does Phosphorylation do?,"['helps many proteins bind the polypeptide', 'helps many proteins bind the polypeptide', 'helps many proteins bind the polypeptide']",Alters protein charge and conformation,Alters protein function and cell signaling,adds a phosphate group,Controls cellular signaling pathways,stimulates or inhibits the function of the molecule,alters protein charge and conformation,regulates cellular processes
Where is Peridinin found?,"['peridinin-type chloroplast', 'chloroplasts', 'chloroplasts']","Marine and freshwater dinoflagellates, clams, sea anemones, and corals","Marine and freshwater dinoflagellates, clams, sea anemones, and corals",in marine dinoflagellates,in many photosynthetic dinoflagellates,photosynthetic dinoflagellates,"marine and fresh water dinoflagellates, clams, sea anemones, and corals",in the peridinin-chlorophyll-protein (PCP) light-harvesting complex in dinoflagellates
Is the packet header long ,"['The packet header can be small, as it only needs to contain this code and any information, such as length, timestamp, or sequence number', 'The packet header can be small', 'small']",Yes,Yes,"No, it is short","Yes, the packet header can be long, ranging from 20 to 60 bytes.","Yes, the packet header can be up to 60 bytes long.",up to 60 bytes,Up to 60 bytes
Who was Philip I?,"['Landgrave of Hesse', 'Landgrave of Hesse', 'Landgrave of Hesse']",King of the Franks,King of the Franks,King of France from 1060 to 1108,King of the Franks from 1060 to 1108,Roman Emperor and father of Maximilian I,King of the Franks,King of the Franks from 1060 to 1108
What are phycobilisomes?,"['relatively large protein complexes', 'large protein complexes', 'large protein complexes']",Aggregates of light-harvesting proteins,Protein complexes anchored to thylakoid membranes,light-harvesting antennae in cyanobacteria and red algae,light harvesting antennae complexes,Light-harvesting antennae complexes,light-harvesting antennae complexes,light harvesting antennae
Who conceptualized the aeolipile?,"['Hero of Alexandria', 'Hero of Alexandria', 'Hero of Alexandria', 'Hero of Alexandria']",Hero of Alexandria,Heron of Alexandria,Heron of Alexandria,Heron of Alexandria,Heron of Alexandria,Hero of Alexandria,Heron of Alexandria
What was telenet ,"['the first FCC-licensed public data network in the United States', 'the first FCC-licensed public data network in the United States', 'first FCC-licensed public data network']",A commercial packet-switched network,A commercial packet-switched network,a Belgian telecommunications company,a packet-switched network,American commercial packet-switched network,American commercial packet-switched network,an American commercial packet-switched network
When were stromules discovered?,"['1962', '1962', '1962']",1888 and 1908,1888 and 1908,in 1997,1888 and 1908,more than 100 years ago,1888 and 1908,1888 and 1908
What replaced the Sky+Box?,"['Sky+HD Box', 'Sky+HD Box', 'Sky+HD Box']",Sky Q,Sky Q,Sky Q Box,Sky Q,The new Sky Box,Sky Q,Sky Q
What was huihui?,"['Muslim medicine', 'Muslim medicine', 'Muslim medicine']","Generic term for China's Muslims, Persian Christians, and Jews",Generic term,Chinese Muslims,"""Hawaiian word for 'to join, intermingle, mix'""",Huihui was a term that historically referred to the Huihe people.,"A generic term for China's Muslims, Persian Christians, and Jews",A term with origins in the Uyghur Khaganate and used to refer to the Hui ethnic group in China
What does rhodophyte mean?,"['red algal chloroplast', 'red algal chloroplast lineage', 'red algal chloroplast lineage']",Red algae,Red algae,red algae,Any red alga of the phylum Rhodophyta,red algae,red algae,Red algae
What religion were the Normans,"['Catholic', 'Catholic orthodoxy', 'Catholic']",Christian,Christianity,Catholicism,Christian,Christian,Catholic,Catholic
What was DATANET 1 ,"['was the public switched data network operated by the Dutch PTT Telecom', 'the public switched data network operated by the Dutch PTT Telecom', 'public switched data network']",First stage of a public packet-switched datanetwork in the Netherlands,The first stage of a public packet-switched datanetwork in the Netherlands,a pioneering computer network in the United Kingdom,one of the first packet-switched networks,The first computer network,The first Dutch packet-switched network,the first Dutch packet-switched network
Where do ctenophora live?,"['marine waters', 'marine waters worldwide', 'marine waters']",Marine habitats,Marine habitats,in marine environments,most marine environments,marine habitats,marine habitats,"marine habitats, particularly in surface waters near shores"
What is an underbid?,"['when builders ask for too little money to complete the project', 'when builders ask for too little money to complete the project', 'builders ask for too little money to complete the project']",to bid less than a competing bidder,To bid less than a competing bidder,a bid lower than the current highest bid,To bid less than a competing bidder,to bid less than (another bid) or less than the bid of (another bidder),Bidding less than a competing bidder,Bidding less than a competing bidder
What is Sanctifying Grace?,"['grace of God which sustains the believers in the journey toward Christian Perfection', 'is that grace of God which sustains the believers in the journey toward Christian Perfection', 'that grace of God which sustains the believers in the journey toward Christian Perfection']",Gift of God's life into the soul,Gift of God's life,a supernatural gift of God that enables us to live a holy life,Infused gift of God's life,"God's freely given presence and power to restore the fullness of God's image in which we are created, and a permanent substance that adheres to the soul unless one rejects God by committing a mortal sin.",infused into the soul by the Holy Spirit,A gratuitous gift of God's life infused into the soul
What surrounds Plastoglobuli?,"['a lipid monolayer', 'lipid monolayer', 'a lipid monolayer']",membrane lipid monolayer,A membrane lipid monolayer,lipid bilayer,a membrane lipid monolayer,membrane lipid monolayer,membrane lipid monolayer,"a membrane lipid monolayer, half-lipid bilayer, and a single peripheral membrane"
When was al-Nimeiry overthrown?,"['1985', '1985', '1985']","April 6, 1985","April 6, 1985","April 6, 1985",April 1985,6 April,"April 6, 1985","April 6, 1985"
EM,,0.1320754716981132,0.11320754716981132,0.09433962264150944,0.11320754716981132,0.09433962264150944,0.10062893081761007,0.10062893081761007
F1,,0.2846855061947455,0.2737968541041755,0.2648946650297806,0.3011652501254698,0.265267495141709,0.2741150514975141,0.2696317243854411
elapsed time,,285.21221506070793,170.5884526810556,0.7263823170332039,4.335149111237916,6.887610114595425,18.74450341260658,40.31834451207575
