Question,GT Answer,"open-squad-short_got-3+demos-sa-knn+cx+t5-nli-ec+ci+[0.3,0.6,0.1]_gpt-3.5-turbo-1106_google","open-squad-short_got-3+demos-sa+cx+t5-nli-ec+ci+[0.3,0.6,0.1]_gpt-3.5-turbo-1106_google",open-squad-short_vanilla_gpt-3.5-turbo-1106_google,open-squad-short_retrieve_then_read_sc_gpt-3.5-turbo-1106_google,open-squad-short_multihop_gpt-3.5-turbo-1106_google,open-squad-short_dsp+sample_gpt-3.5-turbo-1106_google,open-squad-short_dsp+knn_gpt-3.5-turbo-1106_google
Who killed Harold II? ,"['William II', 'Duke William II', 'Duke William II']",An arrow,William the Conqueror,William the Conqueror,William the Conqueror,William the Conqueror,William the Conqueror,Norman invaders under William the Conqueror
What is a typical configuration,"['A typical configuration is to run IP over ATM or a version of MPLS', 'run IP over ATM or a version of MPLS', 'run IP over ATM or a version of MPLS']","Projected average quantity, type, capacity, speed, etc., of components","Projected average quantity, type, capacity, speed, etc., of components",4-4-2 formation,arrangement of components,Tivoli® Enterprise Monitoring Servers,"system populated with projected average quantity, type, capacity, speed, etc., of components","System populated with projected average quantity, type, capacity, speed, etc., of components"
What is septicemia? ,"['(a type of ""blood poisoning""', 'a type of ""blood poisoning""', 'a type of ""blood poisoning""']",Blood poisoning by bacteria,Blood poisoning by bacteria,blood poisoning,Blood poisoning by bacteria,Bacteria entering the bloodstream and causing blood poisoning,Blood poisoning by bacteria,blood poisoning by bacteria
Who were otachi?,"['non-Mongol physicians', 'non-Mongol physicians', 'non-Mongol physicians']",Category IV Kaiju,Category IV Kaiju,a type of kaiju in Pacific Rim uprising,Otachi is a female kaiju.,Kaiju in Pacific Rim,A Kaiju in the film Pacific Rim,Kaiju in Pacific Rim.
Who captured Fort Beausejour?,"['Colonel Monckton', 'Colonel Monckton', 'Colonel Monckton', 'Colonel Monckton', 'British']",The British,British,British forces captured Fort Beausejour,British,British forces captured Fort Beausejour.,British forces,British
what does vBNS stand for ,"['The Very high-speed Backbone Network Service', 'Very high-speed Backbone Network Service', 'Very high-speed Backbone Network Service']",Very high performance Backbone Network Service,very high performance Backbone Network Service,very high-speed Backbone Network Service,Vacation Bible School,very high performance Backbone Network Service,Virtual Base Station,Virtual Base Station
Who founded Woodward Park?,"['Ralph Woodward', 'Ralph Woodward', 'Ralph Woodward']",Ralph Woodward,Ralph Woodward,William G. Woodward,Ralph Woodward,Walter Woodward,Ralph Woodward,Ralph Woodward
How are AUSTPAC connections made ,"['Access can be via a dial-up terminal to a PAD, or, by linking a permanent X.25 node to the network', 'dial-up terminal to a PAD, or, by linking a permanent X.25 node', 'dial-up terminal']",Remote terminal access,Remote terminal access,by using a 9-pin D-type connector,remote terminal access,Through a public packet-switched data network,Through packet switching,Through packet switching
How can pyrenoids replicate?,"['divide to form new pyrenoids, or be produced ""de novo""', 'divide', 'divide to form new pyrenoids, or be produced ""de novo""']",They cannot replicate,Mitotic division,They cannot replicate.,using aphidicolin,binary fission,Through fission,Pyrenoids do not replicate.
What color is phycoerytherin?,"['red', 'red', 'red']",Red,Red,red,red,red,red,red
What does  mnemiopsis eat?,"['fish larvae and organisms', 'fish larvae and organisms that would otherwise have fed the fish', 'fish larvae and organisms that would otherwise have fed the fish']",Zooplankton,"Zooplankton, crustaceans, comb jellies, fish eggs, and fish larvae",plankton,"Zooplankton, crustaceans, other comb jellies, fish eggs, and larvae","zooplankton, crustaceans, other comb jellies, and fish larvae","zooplankton, pelagic fish eggs, and larvae of fish","zooplankton, pelagic fish eggs, and larvae of fish"
Who commissioned the Tapestry?,"['Odo', 'Odo', 'Odo']",Bishop Odo,Bishop Odo,Bishop Odo of Bayeux,Bishop Odo,Bishop Odo,Bishop Odo,Bishop Odo
What does Untersee mean?,"['lower lake', 'lower lake', '""lower lake""', 'lower lake']",Lower Lake,Undersea or below sea level,Undersea,under the lake,lower lake,"""undersea"" or ""below sea level""",Lake in southeastern Germany
Why did he walk?,"['exercise', 'For exercise', 'exercise']",He likes you,Various reasons,to get exercise,Various reasons,Weather forecast,Sign of respect or following her lead,Sign of respect or following her lead
What follows secondary education?,"['tertiary education', 'tertiary education', 'tertiary education']",Postsecondary education,Postsecondary education,Higher education,Postsecondary education,postsecondary education or training,Postsecondary education,Postsecondary education
Where is D'Olier Street?,"['Dublin', 'Dublin', 'Dublin']",Dublin,Dublin,"Dublin, Ireland","Dublin, Ireland","Dublin, Ireland","Dublin, Ireland","Dublin, Ireland"
What shape are Plastoglobuli?,"['spherical bubbles', 'spherical', 'spherical']",Oval or round shaped,Spherical,spherical,spherical,oval or round shaped,round or oval shaped,circular or elongated
What is a connection identifier ,"['a connection identifier rather than address information and are negotiated between endpoints so that they are delivered in order and with error checking', 'negotiated between endpoints']",Unique identifier for network connections,Unique identifier,a unique identifier for a network connection,unique string representing the name of the connection,unique identifier for network connections,A unique identifier for connections within a network,Unique identifier for assigning frames
When was Zia-ul-Haq killed?,"['1988', '1988', '1988']","August 17, 1988","August 17, 1988","August 17, 1988","August 17, 1988","August 17, 1988","August 17, 1988","August 17, 1988"
Telnet Used what  Interface technology,"['host interface to X.25 and the terminal interface to X.29', 'X.25', 'ARPANET']",Command line interface,8-bit channel,command-line interface,command line interface,command line interface,text-based interface,text-based interface
What completed the triad ,"['an interactive host to host connection was made between the IBM mainframe computer systems at the University of Michigan in Ann Arbor and Wayne State', 'the CDC mainframe at Michigan State University in East Lansing', '1972 connections']",strategic bombers,Strategic bombers with nuclear bombs and missiles,the major scale,synthesis and full characterization of homoleptic and heteroleptic carbonyl and nitrosyl complexes of the group VI metals,The third component,"land-based intercontinental ballistic missiles, submarine-launched ballistic missiles, and strategic bombers","confidentiality, integrity, and availability"
What is the IEEE?,"['American Institute of Electrical Engineers', 'the American Institute of Electrical Engineers', 'American Institute of Electrical Engineers']",Institute of Electrical and Electronics Engineers,Institute of Electrical and Electronics Engineers,Institute of Electrical and Electronics Engineers,The Institute of Electrical and Electronics Engineers,The Institute of Electrical and Electronics Engineers,A professional association for electronics and electrical engineering,The Institute of Electrical and Electronics Engineers
What did Donald Davies Develop,"['independently developed the same message routing methodology as developed by Baran', 'the same message routing methodology as developed by Baran', 'message routing methodology']",Packet switching,Packet switching,Packet switching,packet switching,packet switching,packet switching,Packet switching for computer networking
When did Temur rule?,"['1294 to 1307', '1294 to 1307', 'from 1294 to 1307']",1370 to 1405,1370 to 1405,1370-1405,1370 to 1405,1370 to 1405,from 1370 to 1405,1295-1307
Where is Kenya located?,"['in Africa', 'Africa']",East Africa,East Africa,in East Africa,East Africa,"Eastern Africa, bisected by the equator",East Africa,East Africa
What did Mongols worship?,"['the Eternal Heaven', 'Eternal Heaven', 'the Eternal Heaven']",Tengri and Genghis Khan,Tengri,"Tengri, the sky god",nature gods,nature gods,"Tengri, gods, and the sky deity Tengri",Tengri (gods) and the sky deity Tengri
What is an etioplast?,"['a plastid that lacks chlorophyll', 'plastid that lacks chlorophyll', 'plastid that lacks chlorophyll']",Intermediate type of plastid,Intermediate plastid,a plastid in which chlorophyll is not yet developed,An intermediate type of plastid,intermediate type of plastid,intermediate type of plastid,intermediate type of plastid
How do platyctenids reproduce?,"['internal fertilization and keep the eggs in brood chambers until they hatch.', 'internal fertilization', 'internal fertilization']",Using brood pouches,"Asexually, using brood pouches",asexually by budding,sexually and asexually,asexually,"asexually and sexually, and they may use brood pouches","asexually and sexually, and they may use brood pouches"
What protects the statocyst?,"['a transparent dome made of long, immobile cilia', 'a transparent dome made of long, immobile cilia', 'transparent dome made of long, immobile cilia']",anticristae,Sac-like structure,"a hard, calcareous structure",spherical organ,sac-like structure and mineralized mass,The wall of the statocyst sphere contains mechanosensory cells.,It is not clear what protects the statocyst.
Who developed DATAPAC,"['DATAPAC was developed by Bell Northern Research', 'Bell Northern Research', 'Bell Northern Research']",Bell Canada,Data-Pac,NASA and the US Geological Survey,Datapac,Software developers and engineers,Trans-Canada Telephone System,Trans-Canada Telephone System
What is Christian Perfection?,"['a genuine love of God with heart, soul, mind, and strength, and a genuine love of our neighbors as ourselves', 'leading a Spirit-filled and Christ-like life aimed toward love', 'a genuine love of God with heart, soul, mind']",Spiritual union with God,State of being free from sin,the belief that it is possible to live a sinless life,work of God in the heart,Process of achieving spiritual maturity or perfection,A process of achieving spiritual maturity or perfection,Process of achieving spiritual maturity
What did Paul Baran develop ,"['Paul Baran developed the concept Distributed Adaptive Message Block Switching', 'the concept Distributed Adaptive Message Block Switching', 'Distributed Adaptive Message Block Switching']",digital packet switching,Digital packet switching,packet-switching networks,digital packet switching,packet switching,packet switching techniques,packet switching techniques
What happened to Dane?,"['killed in a horse-riding accident', 'killed in a horse-riding accident', 'killed in a horse-riding accident']",He was fired.,He is from Denmark,He was killed.,"He rose to fame, experienced a decline, and is now back on tour.",Injured in car accident,He disappeared and his whereabouts are unknown,He disappeared
What does ATP mean?,"['adenosine triphosphate', 'adenosine triphosphate', 'adenosine triphosphate']",Adenosine triphosphate,Adenosine triphosphate,adenosine triphosphate,Adenosine triphosphate,"ATP could mean ""At This Point"" or ""Answer The Phone"" on TikTok.",Adenosine Triphosphate,Adenosine Triphosphate
What are muroplasts?,"['glaucophyte chloroplasts', 'glaucophyte chloroplasts', 'glaucophyte chloroplasts']",Plastids of glaucophyte algae,Plastids of glaucophyte algae,cell wall precursors in bacteria,plastids with a peptidoglycan cell wall,Microplastics,plastids found in glaucophyte algae,plastids with a peptidoglycan cell wall
What did vBNS do ,"['provide high-speed interconnection between NSF-sponsored supercomputing centers and select access points in the United States', 'provide high-speed interconnection between NSF-sponsored supercomputing centers and select access points in the United States', 'high-speed interconnection']",Provided high-bandwidth network for research applications,Provided high-bandwidth network for research applications,provided high-speed internet access for research and education institutions in the United States,high-speed network backbone,provided high-bandwidth network,Provided high-speed interconnection for scientific and research communities.,Provided high-speed interconnection for scientific and research communities.
What is Plasmodium?,"['the malaria parasite', 'apicomplexans', 'malaria parasite']",Genus of protozoan parasites,Genus of parasites,a genus of parasitic protozoa,a genus of parasitic protozoans,Unicellular parasite,a genus of unicellular eukaryotes,genus of unicellular parasites
What did NSFNET promote,"['advanced research and education networking in the United States', 'advanced research and education networking', 'advanced research and education networking']",advanced research and education networking in the United States,Advanced research and education networking in the United States,research and education in the United States,advanced research and education networking in the United States,interconnectivity and data transfer,advanced research and education networking,advanced research and education networking
How are packets normally forwarded,"['asynchronously using first-in, first-out buffering, but may be forwarded according to some scheduling discipline for fair queuing', 'asynchronously using first-in, first-out buffering', 'intermediate network nodes']",Through the network layer,between a source interface and a destination interface,by routers,by nodes in a computer network,Between source and destination interfaces,By the IP forwarding module.,By the IP forwarding module
What do carotenoids absorb?,"['light energy', 'light energy', 'light energy']",Blue-green light,Blue-green light,blue light,light energy,400 to 600 nm,visible light,visible light
When did Zhenjin die?,"['before Kublai in 1285', '1285', '1285']","January 5, 1286","January 5, 1286",1135,"January 5, 1286","1285 or January 5, 1286","January 5, 1286","January 5, 1286"
When was Qutb executed?,"['1966', '1966', '1966']",1966,1966,1707,1966,1966,1966,1966
What is beta carotene?,"['a bright red-orange carotenoid', 'a bright red-orange carotenoid', 'bright red-orange carotenoid found in nearly all chloroplasts']",A pigment found in plants,Red-orange pigment,a red-orange pigment found in plants and fruits,A red-orange pigment found in plants and fruits,a carotenoid that converts into vitamin A,Beta-carotene is a pigment found in plants that gives them their color and is also a source of vitamin A.,a pigment found in plants that gives them their color and is also a source of vitamin A
What is petrology?,"['the study of rocks', 'study of rocks', 'the study of rocks']",Study of rocks,Study of rocks,"the branch of geology dealing with the origin, occurrence, structure, and history of rocks",study of rocks,the branch of geology that studies rocks,Petrology is the study of rocks and the conditions under which they form.,study of rocks and their formation
What seldom mutates?,"['The inverted repeat regions', 'inverted repeat regions', 'inverted repeat regions']",Mutations,Outbreaks,Mitochondrial DNA,Mutations rarely impact outbreaks dramatically.,Some mutations,Coronaviruses,Some genetic material seldom mutates.
Where did Jebe die?,"['on the road back to Samarkand', 'on the road back to Samarkand', 'the road back to Samarkand']",Mongolia,Near Khortytsia Island,in the Gobi Desert,Near a kurgan close to Khortytsia Island,Mongolia,Conflicting sources mention Mongolia or the road back to Samarkand.,Mongolia
Where do platycenida live?,"['on rocks, algae, or the body surfaces of other invertebrates', 'rocks, algae, or the body surfaces of other invertebrates', 'rocks, algae, or the body surfaces of other invertebrates']","on rocks, algae, soft coral, or the body surfaces of other invertebrates","On rocks, algae, soft coral, or the body surfaces of other invertebrates",in Australia and New Guinea,"on rocks, algae, soft coral, or the body surfaces of other invertebrates",On the bark of trees,"on rocks, algae, soft coral, or the body surfaces of other invertebrates","On rocks, algae, soft coral, or the body surfaces of other invertebrates"
How is circuit switching charecterized ,"['by a fee per unit of connection time, even when no data is transferred', 'a fee per unit of connection time', 'fee per unit of connection time']",Fixed bandwidth and connection-oriented,Entire message sent through dedicated channel,by dedicated communication channels,"connection-oriented, fixed data transfer",dedicated physical path,"fixed bandwidth, data transmission rate, connection-oriented","Fixed bandwidth and data transmission rate, connection-oriented"
Purpose of Telnet ,"['making ARPANET technology public', 'a means of making ARPANET technology public', 'making ARPANET technology public']",Remote computer access,Terminal communication and remote login,remote login and control,Remote access and control,remote login,Remote access and text-based communication,remote access and communication
Where do dikes form?,"['in areas that are being actively deformed', 'areas that are being actively deformed', 'in areas that are being actively deformed']",In a fracture of a pre-existing rock body,In rock formations,along the edges of rivers or in coastal areas,in existing fractures or new cracks,In fractures of pre-existing rock bodies,fractures or cracks in existing rock,In river channels from sediment deposits or in geology when magma rises into existing fractures or creates new cracks.
What was Apple Talk ,"['a proprietary suite of networking protocols developed by Apple Inc. in 1985', 'a proprietary suite of networking protocols developed by Apple Inc', 'proprietary suite of networking protocols']",A suite of networking protocols,Suite of networking protocols,a proprietary suite of networking protocols developed by Apple Inc.,A set of proprietary networking protocols,A suite of networking protocols,suite of networking protocols,A discontinued proprietary suite of networking protocols developed by Apple Computer
What is a prasinophyte?,"['a green algal derived chloroplast', 'a green algal derived chloroplast', 'green algal derived chloroplast']",A group of unicellular green algae,Unicellular green algae,a type of green algae,unicellular green algae,A group of unicellular green algae,unicellular green algae,unicellular green algae
Who founded Telnet ,"['Larry Roberts', 'ARPA IPTO director Larry Roberts', 'Larry Roberts']",Telnet was developed in 1969.,Committee of researchers,Ray Tomlinson,Bolt Beranek and Newman (BBN),Telenet Inc.,Bolt Beranek and Newman (BBN),"Larry Roberts, Burian Carew, and Dr. Denloye"
What did NSFNET eventually provide,"['it developed into a major part of the Internet backbone', 'a major part of the Internet backbone', 'major part of the Internet backbone']",advanced research and education networking in the United States,Access to supercomputer centers,the backbone for the modern internet,high-speed internet connectivity,high-speed backbone for networking services,Access between the supercomputer centers and other sites over the backbone network,Access between supercomputer centers and other sites over the backbone network at no cost.
What is a Hauptlied?,"['main hymn', 'hymn', 'main hymn']",prominent hymn for Pentecost in German-speaking Lutheranism,Chief hymn,a principal song in a musical composition,A main song,Choral music,main hymn,main hymn
Who served his dinner?,"['headwaiter', 'the headwaiter', 'the headwaiter']",Freddie Frinton,George,his wife,husband's family,He served his own dinner.,The guest of honor,The guest of honor
What did Tymnet connect ,"['connect host computers (servers)at thousands of large companies, educational institutions, and government agencies', 'host computers (servers)at thousands of large companies, educational institutions, and government agencies', 'host computers']",Host computers,Host computers,businesses and individuals to the Tymnet network,"host computers at large companies, educational institutions, and government agencies","host computers at thousands of large companies, educational institutions, and government agencies","host computers (servers) at thousands of large companies, educational institutions, and government agencies","host computers at large companies, educational institutions, and government agencies"
What distinguishes stromal thylakoids?,"['are in contact with the stroma', 'in contact with the stroma', 'helicoid sheets']",50% protein and 50% lipid,Absorb sunlight,They are not directly involved in the light reactions of photosynthesis.,location and function,location and function,distribution of proteins,distribution of proteins
What are chromoplasts?,"['pigment-filled plastids responsible for the bright colors seen in flowers and ripe fruit', 'pigment-filled plastids', 'pigment-filled plastids responsible for the bright colors seen in flowers and ripe fruit']",Colored plastids containing carotenoid pigment,Pigmented plastids,plastids that contain pigments and are responsible for the color of fruits and flowers,pigmented plastids,Colored plastids containing carotenoid pigment,Colored plastids containing carotenoid pigment,plastids responsible for pigment synthesis and storage
Who was the hostage?,"['Duncan', 'Duncan', 'Duncan']",American diplomats,American diplomats,King Richard I of England,American diplomats,American citizen,a rabbi and three others,American diplomats
Who conducted this survey?,"['American Association of University Women', 'American Association of University Women', 'American Association of University Women']",Surveyor or Researcher,Surveyor or pollster,Pew Research Center,surveyor or researcher,reputable research organization or hotel research organization,Surveyor or researcher,The survey may have been conducted by a surveyor or researcher.
What was Galileo Ferraris?,"['physicist', 'physicist', 'Italian physicist']","Italian university professor, physicist, and electrical engineer","Italian university professor, physicist, and electrical engineer",an Italian physicist and electrical engineer,physicist and electrical engineer,"Italian university professor, physicist, and electrical engineer","Italian university professor, physicist, and electrical engineer","physicist, university professor, and electrical engineer"
What distinguishes granal thylakoids?,"['are arranged in grana', 'arranged in grana', 'arranged in grana']",Protein composition,Connected by stromal lamellae,They are stacked into grana.,protein composition,helical intersection by unstacked stroma lamellae,protein composition,protein composition
Who may assign Elders?,"['District Superintendents', 'ordained by a bishop', 'District Superintendents']",Existing leadership,Existing leadership or eldership team,The pastor,existing leadership,Apostles and the broader congregation,Existing leadership,existing leadership and the Holy Spirit
Who operated the vBSN network ,"['The network was engineered and operated by MCI Telecommunications under a cooperative agreement with the NSF', 'MCI Telecommunications', 'National Science Foundation']",University of South Florida,MetaverseSociety,Verizon Wireless,University of Alicante (UA),MetaverseSociety,Blockdaemon,University of Alicante (UA) in collaboration with the Instituto Geográfico Nacional (IGN)
Who founded the UMC?,"['union of the Methodist Church (USA) and the Evangelical United Brethren Church', 'John and Charles Wesley in England', 'the union of the Methodist Church (USA) and the Evangelical United Brethren Church']",John and Charles Wesley,The Evangelical United Brethren Church and The Methodist Church,John Wesley and Charles Wesley,John and Charles Wesley,"John and Charles Wesley, Philip William Otterbein, Martin Boehm, and Jacob Albright","John and Charles Wesley, Thomas Coke, and Francis Asbury",John and Charles Wesley
Where was Dyrrachium located?,"['the Adriatic', 'the Adriatic', 'Adriatic']",Albania and Montenegro,Modern Albania and Montenegro,in modern-day Albania,"Durrës, Albania",Adriatic coast of modern Albania,modern-day Albania,eastern shore of the Adriatic Sea
What are phytoplankton?,"['planktonic plants', 'planktonic plants', 'a vital part of marine food chains']","the foundation of the aquatic food web, the primary producers",Single-celled organisms,microscopic algae or bacteria,Microscopic plant-like organisms,Microscopic marine algae,Microscopic marine algae,microscopic marine algae at the base of aquatic food webs
Who did internet2 partner with ,"['a partnership with Level 3 Communications to launch a brand new nationwide network', 'Level 3 Communications', 'Qwest']","Amazon Web Services, Google Cloud Platform, and Microsoft Azure",Key organizations,NASA and the National Science Foundation,"key organizations, global research networks, state and regional research and education networks, Qwest",Amazon Web Services,"key organizations, security, trust, identity experts, cloud services, regional and state network providers",Amazon Web Services
How are ergänzungsschulen funded?,"['tuition', 'tuition', 'tuition fees']",tuition fees,State subsidies and parents,by the government,tuition fees,tuition fees,Through tuition fees.,"tuition fees, private individuals and organizations, and public funding"
