Question,GT Answer,"hotpotqa-long_got-3+demos-sa-knn+cx+t5-nli-ec+ci+[0.3,0.555,0.145]_gpt-3.5-turbo-1106_google"
"David Wayne Hull (born 1962 or 1963) is a leader of which group that originated in Mississippi in the early 1960s under the leadership of Samuel Bowers, its first Grand Wizard?",['White Knights'],White Knights of the Ku Klux Klan
"Ist das Ihr Fahrrad Mr O’Brien? is a German biographical radio play about life, works and legacy of an Irish novelist whose many satrical columns were written under what name?",['Myles na gCopaleen'],Myles na gCopaleen
"When was the Indian film actor, producer and playback singer born who debut with the 2000 War film, ""Refugee"" and had lead role in Main Prem Ki Diwani Hoon?",['5 February 1976'],1976
"The song by English indie rock band Florence and the Machine written by Florence Welch and Francis ""Eg"" White and released in 2011 is named after the painting which was completed in which year?",['1938'],1938
"What is the name of the American author, songwriter, educator, lawyer, diplomat, civil rights activist and husband to Grace Nail Johnson who was the first African American executive secretary of the National Association for the Advancement of Colored People (NAACP)?",['James Weldon Johnson'],James Weldon Johnson
"What is the name of the actress who played as Blair Cramer from the daytime drama series ""One Life to Live"" for 20 years who is also currently playing as Eve Donovan on ""Days of Our Lives""?",['Kassie DePaiva'],Kassie DePaiva
"In ""Bon Cop, Bad Cop"", Canadian actor Rick Howland played the role of Harry Buttman (a parody of Gary Beltman), who is the current commissioner of what National sports league? ",['National Hockey League (NHL)'],National Hockey League (NHL)
"What was a series of battles during the Revolutionary War, for control of New York City and the state of New Jersey, fought on October 28, 1776 near White Plains, New York?",['New York and New Jersey campaign'],The Battle of White Plains
"A pakistani photogropher was the personal photographer of a Pakistani politician who served as Prime Minister of Pakistan from 1973 to 1977,and who also served in what political office prior to that?",['President of Pakistan'],President
"The extended play (EP) ""Calibraska"" by the American pop-rap duo Jack & Jack, known for their 2014 single ""Wild Life,"" is a portmanteau of what two U.S. states?","['Nebraska, where the duo originate, and California, where they are now based']",Nebraska and California
"During the 2012-13 Blackppol F.C. season, their top scorer was what English professional footballer who plays as wither an attacking midfielder, winger, or forward for Premier League club Huddersfield Town?",['Thomas Christopher Ince'],Tom Ince
"""Show 'Em (What You're Made Of)"" is a song written by a group of people including an American singer/songwriter who was inducted into what on April 10, 2015?",['Kentucky Music Hall of Fame'],Kentucky Music Hall of Fame
"WHAT WAS THE NAME OF THE BOOK MADE INTO THE 2015 SOUTH KOREAN CRIME THRILLER, THE DEAL, DIRECTED BY SON YONG-HO AND FEATURING SOUTH KOREAN ACTOR PARK SUNG-WOONG (BORN JANUARY 9, 1973) AS A SERIAL KILLER?","['""Murder Request""']",Murder Request
"The American comedy film Krystal stars which actor who appeared in numerous films such as ""Contact"", ""Armageddon"", ""The Perfect Storm"", ""Crash"", ""Blades of Glory"", ""Black Hawk Down"", ""Nine Lives"", etc.?",['William Fichtner'],William H. Macy
"Although he mostly provided backing vocals as part of this group, Mark Owen's first single ""Four Minute Warning"" released on 4 August 2003, was once part of this English pop music group.",['Take That'],Take That
"In which year was the American politician, that both represented New York in the United States Senate and served as an adviser to President Richard Nixon, re-elected for a fourth term as U.S. Senator?",['1994'],1982
"Who was the wife of the United States Army lieutenant general who received the Distinguished Service Cross, and was the first of his West Point class to be promoted to brigadier general, major general, and lieutenant general",['Julia Compton Moore'],Julia B. Compton Moore
High Water is a song by Bob Dylan it was based on the 1927 Lousiana Flood. Another song recorded by Dylan about the event is When the Levee Breaks who is the Husband and Wife team that wrote and recorded this song in 1929 ?,['Joe McCoy and Memphis Minnie'],Memphis Minnie and Kansas Joe McCoy
"What is the genus of the viral disease that has symptoms such as fever, chills, loss of appetite, nausea, muscle pains, and headaches, and has a chance of causing liver damage?",['Flavivirus'],Hepacivirus
"Don Swayze was one of five children.  His older brother was trained in dance by their mother, Patsy Swayze, leading to his role in ""Dirty Dancing"".  Who is his older brother?",['Patrick Swayze'],Patrick Swayze
"The actor that plays Phileas Fogg in ""Around the World in 80 Days"", co-starred with Gary Cooper in a 1939 Goldwyn Productions film based on a novel by what author?",['Charles L. Clifford'],Emily Brontë
"Who is this American cartoonist, writer, producer, animator, and voice actor that worked with this multiple Shuster Award, Harvey Award and Eisner Award nominee and an Eisner Award–winning comic book creator?",['Matt Groening'],Matt Groening
What is the name of the US battleship best know for the setting of the film Under Siege and the site of the surrender of the Empire of Japan to end World War II?,"['U.S. Navy battleship USS ""Missouri""']",USS Missouri
"Which of the fighter in Battle of Gavinana was created in 1422, and came to an end when the Holy Roman Empire was wound up in 1806, as the result of the Napoleonic Wars?",['Army of the Holy Roman'],the Holy Roman Empire
Who was the king of England who became king after the death of his younger brother and whose reign was chaotic due to rivalry with relatives until his own death a few decades later?,['Stephen of Blois'],Edward II
"In which year was the author born that wrote about  the former succubus Jezebel, now the mortal Jesse Harris, as she tries to avoid her Hellish past and learn how to be truly human?",['1970'],1970
"Which player, who also played for the New Jersey Nets and the Golden State Warriors, finished third in the league with 231 three-point field goals during the 1995-96 Atlanta Hawks season?",['Mookie Blaylock'],Mookie Blaylock
Until what year did the Chief of Justice of the Supreme Court that administered the presidential oath of office to Abraham Lincoln on his first inauguration as the 16th President of the United States hold that office?,['1864'],1864
EM,,0.39416058394160586
F1,,0.559358443665013
elapsed time,,1.7957770250139444
