Question,Answer,Level,Question Length
What is the name of the first disc in the album the residency show I Am... Yours was held in support of?,"""I Am...""",medium,24
"Which film/sitcom aired last starring Molly Ephraim, ""Gravy"" or ""The Last Man Standing""?","""Last Man Standing""",medium,19
"Who is a University of British Columbia film professor, Ulrike Ottinger or Rachel Talalay?",Rachel Talalay,easy,16
The author of the 1981 book The Decline and Fall of the Roman Church was born in what year?,1921,medium,20
George Herbert Walker's great-grandson graduated from where in 1968?,Yale University,medium,11
Who directed the 1991 British-American black comedy fantasy film which Carlos Davis author the screenplay,Ate de Jong,medium,15
Bot ha steal and a blind are used in which card game to make others fold superior hands?,poker,medium,19
"Which magazine, The Fader or Playgirl featured semi-nude or fully nude men?",Playgirl,hard,14
Eleanor Worthington Cox is best known for her role in this musical based on a children's novel written by who,Roald Dahl,medium,21
On what date was John Haase's associate born?,31 May 1963,medium,10
"In early September 2009, Robert Flores was replaced by which American sportscaster who has been an anchor for ESPN since 1996?",John Buccigross,medium,23
"Which Italian dancer born on  March 26, 1975 performed with The La Scala Theatre Ballet?",Roberto Bolle,medium,17
"What nationality is the father for the author of ""Mary Barton""?",Scottish,hard,14
"The 2017 Senior League World Series took place from July 29–August 5 in Easley, South Carolina, guadulce, Panama defeated Coral Springs, Florida in the championship game, which is a city in Broward County, Florida, United States, approximately 20 mi northwest of which city?",Fort Lauderdale,easy,52
WGCA-FM serves an area of Missouri with what population?,"17,606",medium,10
"""Pour It Up,"" a song by Rihanna, was featured on an album that was released in what month?",November,hard,23
"Which hospital was establish almost a century before the other, Howard University Hospital or the Psychiatric Institute of Washington?",Howard University Hospital,medium,21
The home of the Australian Army School of Infantry is found 8 km south of a town on the banks of what river?,Hunter River,medium,24
 Norbury is a village with links to the family of an English novelist who wrote what book in 1859?,Adam Bede,medium,20
What date was the Auatrailian politiican who has been a member of the Australian House of Representatives since 1996 swarn into the 68th ministry of the Austrailing government?,27 June 2013,hard,29
 Rangers also made moves to acquire an American-born Mexican professional baseball infielder born in what year?,1982,medium,17
Andy Holt was played by Warren Brown in what soap opera?,Hollyoaks,easy,12
What is the date of birth of the person who was unsuccessfully challenged by R. J. Harris in 2010?,"April 28, 1949",hard,20
"Which US Ford car is in its sixth generation, and introduced the Ford AXOD transmission on its debut in 1986?",Ford Taurus,medium,22
Professor George W. Bernard typically debates with an English constitutional historian about which historical event?,reign of King Henry VIII,hard,16
"Where was the Canadian multinational mass media information firm, that took over the Reuters News Agency in 2008, founded?","Toronto, Ontario, Canada",medium,22
"What American professional baseball pitcher for the New York Mets created an online archive of rare, long-lost, and relatively unknown Canadian music with Beau Levitt?",Kevin McGowan,easy,28
Which tower is found near Portsmouth Harbour railway station?,Spinnaker Tower,hard,10
Jeff Posey played college football for the university that is a member of what conference?,Conference USA,medium,16
"After leaving Burnley, Neil Lindsay joined a club based in which city ?","Clitheroe, Lancashire",medium,14
Has both The Panama Deception and We Come as Friends won any awards?,yes,medium,14
"Which tv series, premiering on Fox in the United States on September 28, 2014, titled it's third episode, ""Super Franchise Me""?",The Simpsons,medium,29
Wagnney Silva Fabiano-Santos practiced martial arts with the company that was founded in what location?,"Las Vegas, Nevada",easy,16
Did both Frank Daniel and Willard Huyck develop advancments in screenwriting?,no,medium,12
In what city was the consigliere to the boss of the Bonanno crime family born?,"Castellammare del Golfo, Sicily",hard,16
Otis Sistrunk played his entire NFL career with a team from what state?,California,hard,14
"English cow's-milk cheese from the county of Lancashire includes Bowland cheese, which is a cheese that is mixed with what?","apple, sultana and cinnamon prior to setting",easy,22
Willem Frederik count of Bylandt commanded a Belgian-Dutch infantry brigade in a battle that took place on what date?,16 June 1815,hard,20
Who was the first governor of the eighth least populous U.S. state?,Nicholas Cooke,medium,13
Were Pavel Alexandrov and Valentin Turchin were both what?,Soviet,hard,10
What was released first: Macross Frontier or The Super Snail Adventure?,Macross Frontier,medium,13
Which member of FC Barcelona scored the only goal in the 2010 FIFA World Cup Final?,Andrés Iniesta,medium,17
What was the name of the Kentucky-based site that a 2005 horror movie was filmed at?,Waverly Hills Sanatorium,medium,17
"Gordon Lish (born February 11, 1934 in Hewlett, New York) is an American writer, as a literary editor, he championed many American authors, particularly Rick Bass (born March 7, 1958) is an American writer and ?",environmental activist,easy,46
Which English actor co-wrote and also played in The Dictator?,Sacha Baron Cohen,medium,11
Felice Trojani collaborated with Umberto Nobile on which aircraft that was the first to reach the North Pole?,Norge,medium,19
"Which is farther south, 45 Broad Street or 520 Park Avenue?",45 Broad Street,hard,13
" Robert ""Bob"" Crowley is a former teacher and reality TV personality, known for winning the seventeenth season of the American TV series ""Survivor”, the American version of the international ""Survivor"" reality competition television franchise created by who?",Charlie Parsons,easy,46
What was the governing body of the national team that Nobuyuki Kojima played for?,Japan Football Association,hard,15
"Are both the 1982 film ""Burden of Dreams"" and the 2001 film ""A Boy Named Sue"" considered documentaries?",yes,medium,23
"Team Brunel finished second in the 2014–15 Volvo Ocean Race, skippered by Bouwe Bekking, and will also sail in the 2017–18 Volvo Ocean Race, the 13th edition of the round-the-world Volvo Ocean Race, it will start in Alicante, in which country?",Spain,easy,47
"What pizza chain is headquartered in Texas, Papa John's Pizza or Gatti's Pizza?",Gatti's Pizza,medium,17
What Prince Regent likely stayed in Carlton House in 1811?,George IV,medium,11
Which film directed by Luis Prieto was distributed by Aviron pictures in 2017?,Kidnap,medium,14
What country are Paul Hunter and Paul Bernardo from?,Canada,hard,10
Demofoonte was an opera by the composer who was part of what period?,early classical,hard,14
"Which genus has more species, Eccremocarpus or Pittosporum?",Pittosporum,medium,10
"""Live Forever"" is a song released as the third single from which debut studio album by English rock band Oasis, released on 29 August 1994 by Creation Records?",Definitely Maybe,medium,32
"What was the original release name of the movie for which Carlo Savina arranged, and conducted music, adapted from the novel ""The Grizzly King""?",L'Ours,medium,29
"The comedian who starred in ""The Librarian: Return to King Solomon's Mines"" made his debut during which 1960s show?",The Button-Down Mind of Bob Newhart,medium,24
Sean Lawlor appeared in the 1993 Irish-British-American courtroom drama film directed by whom?,Jim Sheridan,medium,14
What comedian who starred on Saturday Night Live later appeared in A Thousand Words?,Eddie Murphy,medium,15
"Sorry is a 1966 song that was written by Stevie Wright and another Australian musician who moved to Australia with his family as a teenager, but was born where?",Scotland,medium,31
Who was the interim coach of the team that won the 17th iteration of the Alamo Bowl?,Ruffin McNeill,medium,18
What occupation did George Gershwin and Jacques Offenbach share?,composer,hard,10
"Which film was released first, Manson or A Funny Thing Happened on the Way to the Moon?",Manson,medium,19
What was the name of the group of African-American military pilots who fought in World War II with prestigious members such as Harold K. Hoskins?,Tuskegee Airman,hard,26
"What is the name of the American Major League Baseball player, who is the father of a major league player, four-time All-Star, both in November 1947?",Ray Boone,hard,30
"The UCF Knights women's soccer program represents which American metropolitan public research university in Orlando, Florida, and is the largest university in the United States by undergraduate enrollment, as well as the largest enrollment at a single campus?",University of Central Florida,easy,43
The finale episode of season 15 of South Park was what numbered episode?,223rd episode,easy,14
When was the woman for which Bathory was named born?,7 August 1560,medium,11
"What year was the mixed martial artist born, who was defeated by the former Tachi Palace Fights Featherweight Champion?",1987,medium,21
"Who was buried in a tomb located in Dra Abu el-Naga and lived during the reign of who often is regarded as the greatest, most celebrated, and most powerful pharaoh of the Egyptian Empire?",Bakenkhons I,hard,37
Love Has Come for You was produced by the singer who first came to notice as a member of which pop duo?,Peter and Gordon,medium,23
Which American actress appeared on Dr. Alien and Little House on the Prairie?,Olivia Barash,medium,14
"Cowboy Up stars the actor best known for which role on the series ""24""?",Jack Bauer,medium,17
"""Finest Worksong"" is the third and final single, released from American alternative rock band R.E.M., and its fifth studio album, released on September 1, 1987?",Document,easy,32
"The Hong Kong company listed on what, cooperates with the operator of Guangzhou-Shenzhen Railway?",Hong Kong Exchange,easy,16
"Which facility was founded at an earlier date, University of Pittsburgh or University of California, San Francisco?",University of Pittsburgh,medium,20
Chris Taylor stared in a film directed by who?,Joel Silberg,medium,10
Bridge of Spies tells the story of an American lawyer who ultimately became what?,General Counsel of the OSS,hard,15
"Greg Hoffman was working on ""Saw III,"" a 2006 American horror film, but was unable to finish his work on the film, which was directed by who?",Darren Lynn Bousman,medium,33
Which commander-in-chief of the Hellenic Army also instituted The Royal Order of George?,Constantine I,medium,14
"Which Norwegian explorer, who crossed Greenland in 1888, was best known for his ""Fram"" expedition?",Fridtjof Nansen,medium,20
What island is the only home to the snake commonly known as The Golden Lancehead?,Ilha da Queimada Grande,medium,16
"Aspects of Andrew Lloyd Webber is the second studio album by a singer that played what role in theAustralian premiere of ""The Phantom of the Opera""? ",Christine Daaé,medium,29
"The actress appeared as Maryann in the show Cybill won a Tony Award for ""The Real Thing"" in what year?",1984,easy,23
"in the ""Search Committee""  episode, Deangelo's new replacement is sought out through a search committee process led by a character whose role is played by an American actor who was born when?","October 20, 1979",medium,37
"One of LNK TV's sister channels is a Lithuanian news television station that started to air on November 12, 2007, and the range is what percent of Lithuanian television users?",97%,medium,34
Are both Fazoli's and Papa John's Pizza based out of Kentucky?,yes,medium,14
Which band was formed first Lit or Balance and Composure?,Lit,medium,11
Did both Colin Hay and Dustin Kensrue perform in bands before becoming solo artists?,yes,medium,15
Former Arena Football QB Justin Roper played two colleges one of which is Known as the Duck and fielded its first team in what year?,1894,medium,26
Where does the team play that Brad Fox played for that is a part of the WAFL?,Lathlain Park,hard,18
Air Italy is a subsidiary of what privately owned Italian airline?,Meridiana,medium,12
Which of the two tornado outbreaks killed the most people?,"March 2 and 3, 2012",hard,11
"A, Lolita, My Love is a musical based of the novel ""Lolita"" which was written by which author?",Vladimir Vladimirovich Nabokov,easy,23
Did Chuck Schuldiner and Gary Cherone ever play in the same bands?,no,medium,13
"Q: Name the famous person known for his strong practice of the political ideology of Ulster loyalism, whom went by the nickname, ""Doris Day"". ","James Gray (1958 – 4 October 2005), known as Jim Gray, was a Northern Irish loyalist and the East Belfast brigadier of the Ulster Defence Association (UDA), the largest Ulster loyalist paramilitary organisation in Northern Ireland.",easy,30
"American novelist, Mark Powell, is the author of the the novel ""The Dark Corner"", and serves as what for the private four-year co-education liberal arts college, Lincoln Memorial University?",fiction workshop leader,medium,36
To when was the pottery of one of the civilization featured in Age of Empires II: The Conquerors dated,around 8000 BC,medium,20
"What is the birth date of this Tyrolean mountaineer, agricultural scientist, geographer, and cartographer who played the husband of Lhak[a Tsamchoe in Seven Years in TIbet?",2 November 1899,medium,32
Are both Polish Lowland Sheepdog and Large Münsterländer native to the same country?,no,medium,14
The Laboratory for Energy Conversion  is part of the engineering and math university in what country?,Switzerland,medium,17
Ramblin' Root Beer was made by the Coca-Cola Company until which brand of root beer was purchased by them in 1995?,Barq's,medium,23
"Which American film Director was born earlier, Irving Cummings or Chris Buck?",Irving Camisky,hard,14
"The band that released the song ""Back to the 80's"" have sold approximately how many albums and singles?",33 million,medium,22
When was the aircraft manufacturer at which Klapmeier brothers was a co-founder founded? ,1984,medium,14
"In what year was the man that resigned as the president of Israel before the Israeli presidential election, 2000 born?",1924,medium,22
Some performance of Take a Bow took place near the bank of which river?,River Thames,hard,15
An American author of political thrillers endorsed a novel by which New York Times best-selling author?,Chris Kuzneski,medium,17
How do Sumner Murray Redstone and Carl Folta know each other?,he served as Sumner Redstone's senior adviser and spokesman,hard,12
"What position was an Australian former professional rugby Australian Kangaroos' all-time highest point-scorer, in a township 120 kilometres south of Sydney in the Illawarra, New South Wales, Australia in the Municipality of Kiama?",goal-kicking centre,easy,38
"Who is a German composer and musician from the Baroque period that composed Ach Gott, wie manches Herzeleid BWV 58?.",Johann Sebastian Bach,medium,23
Magazines or Novels contains a song the was ranked triple-platinum by who?,the RIAA,easy,13
Brian Gallivan was an actor who created a web series for the network run by the theatre troupe based in what city?,Chicago,hard,23
What American stock car racing driver has won the NextEra Energy Resources 250 and had the second most wins in the Nationwide Series (as of 2014)?,Mark Martin,medium,29
Which company created the network that airs Animal Stories?,Turner Broadcasting,medium,10
Interstate 20 travels through what Rockdale County city in Georgia?,Conyers,medium,11
"Which American director directed the horror film ""The Omen"" in 1976, Richard Donner or William Keighley?",Richard Donner,easy,20
What lake is located near the largest shopping center in New York?,Onondaga Lake,medium,13
"The star of 1990 television movie ""Big Bad John"" played which character in James Bond movie ""Diamonds Are Forever""?",Willard Whyte,medium,24
When did the series that Tyler Ross stars in with Josh Duhamel premier?,"March 1, 2015",hard,14
"Among Gogea Mitu and Gheorghe Mureșan, who is the tallest man in Romania?",Gheorghe Dumitru Mureșan,medium,15
Approximate what percentage of the Canadian population live in the province in which Ivan Woods was born ?,nearly 40 percent,hard,18
Special Generation sang heart felt harmonic background vocals on several MC Hammers hit releases like which track considered to be Hammer's signature song and is his most successful single?,U Can't Touch This,medium,31
The serial killer who shares the same name as a Spokane-Coeur d'Alene-American novelist born in 1966 is known for doing what to his victims?,scalps white men,hard,25
What Brazilian racing driver died in an accident during the 48th season of FIA Formula One motor racing?,Ayrton Senna,hard,19
"Which author is French, Andre Dubus III or Monique Wittig?",Monique Wittig,medium,12
In what year was Josph Campbell's widow born?,1916,medium,10
How to Train Your Dragon includes a 2014 short film directed by whom?,Elaine Bogan and John Sanford,medium,14
Elms College Blazers plays in a collegiate conference based in which location ?,Northeastern United States,medium,13
For how many terms was this Indiana State Senate senator and Chief Justice of the Supreme Court of Indiana elected in the Indiana State Senate after whom the Howard Park Historic District is named?,two terms,hard,35
Which 2015 Chinese comedy film is a remake of Miss Granny and stars the winner of Outstanding New Actress at the Huabiao Awards?,20 Once Again,medium,24
Which television series was also based on a series of books written by Georges Prosper Remi?,The Adventures of Tintin,medium,17
"Which ""Of Mice and Men"" character was portrayed in 1939 by a star of the 1965 American Western film Black Spurs?",Lennie Small,medium,24
"Who is the actress who co-stared in the comedy series ""Peter Kay's Car Share"" with actor Peter Kay?",Sian Gibson,medium,22
"Which opera had more acts, Das Liebesverbot or Lucia di Lammermoor?",Lucia di Lammermoor,medium,13
"Who directed an upcoming Canadian comedy film which stars the actress who played Sharon ""Athena"" Agathon on ""Battlestar Galactica""?",Kyle Rideout,easy,24
"Buddy Stephens is an American football coach who is currently the head coach at East Mississippi Community College, where he coached players such as which American football quarterback for the Denver Broncos of the National Football League (NFL), and played college football at Clemson and Ole Miss?",Chad Kelly,easy,52
Jerry Bingham produced Batman: Son of the Demon for which comicbook publisher in 1987?,DC Comics,medium,16
"Question: What characters did the focus of the 2011 documentary I Am Nancy play in the sitcom ""Growing Pains""?",Marie Lubbock and Amy Boutilier,medium,23
The red carpet host of the 2016 KBS Entertainment Awards also won which K-pop reality show?,Produce 101,medium,17
St. Clair Bayfield is best known as the manager of an American socialite who was ranked as what by Stephen Pile?,the world's worst opera singer,medium,22
"The song ""Alone"" incorporating uncredited vocals provided by Swedish recording artist Noonie Bao and released in 2016, is by which Norwegian record producer and DJ born in 1997?",Alan Walker,medium,32
Jeannie Berlin appeared in what eight-part crime drama in 2016?,The Night Of,hard,11
Are Mehran University of Engineering and Technology and Michigan Technological University in the same country?,no,medium,16
The Maine Guides were an American minor league baseball franchise that played in a town with a population at the 2010 census of what?,"8,624",medium,25
 A Decent Ride is a novel that takes place 10 years after which 2002 Irvine Welsh novel?,Porno,medium,18
Which brand sponsored the competition that Reggina Calcio was re-promoted to?,TIM,hard,12
"Strike It Rich starred what member of ""The Facts of Life""?",Molly Ringwald,hard,14
"Who wrote a biography of the jazz musician that lived his adult life as a man, but was assigned female at birth?",Diane Helen Wood Middlebrook,hard,24
What medal did the new namesake of the campus of the Patchogue-Medford High School receive,the Medal of Honor,medium,15
Which has the highest scope of profession in Mike Love or Nick Cave ,Nick Cave,medium,13
"Henry Paul and Thom Yorke, have which mutual occupations?",singer/songwriter,easy,11
Who was the head coach of his third football team that lost 13-14 to football team that represented Iowa State University in the 2009 NCAA Division I FBS football season?,Tim Brewster,easy,31
"Which movie came out first, Flubber or Finding Dory?",Flubber,hard,11
"Which individual founded a religion throughout their lifetime, Aleister Crowley or John Millington Synge?",Aleister Crowley,medium,16
"Which co-host of the broadcast event of ""Children in Need 2015"" is best known for her work in pop groups S Club 8 and The Saturdays?",Rochelle Humes,medium,29
In between Zaozhuang and Guiping which one is under the administration of Guigang City?,Guiping,medium,15
"What is a 1997 American action film directed by Simon West, written by Scott Rosenberg and stars a man who was nominated for a Golden Globe Award for Best Actor – Motion Picture Musical or Comedy for his performance in ""High Fidelity"" (2000)?",Con Air,easy,49
Korean actress Shin Min-a starred in Oh My Venus and what other television dramas?,A Love to Kill,medium,15
When was the The New Hampshire Rail Transit Authority that is attached to the government agency The New Hampshire Department of Transportation created?,2007,medium,24
"Rhonda Vincent, who appeared on the album ""That's why I Sing this Way"" has been called the ""new queen of"" what, by the Wall Street Journal",Bluegrass,hard,33
Straits of Moyle is a narrow expanse of sea that connects the Irish Sea with what body of water?,Atlantic Ocean,medium,20
Where did the CEO of Regent University attend a rally in 1980?,"Washington, D.C.",hard,13
Are Portsmouth Cathedral and Newcastle Cathedral both located in England?,yes,medium,11
Monte Amundsen appeared in a Broadway musical with an actress who died in what year?,1992,medium,16
"What military organization featured the general who was declared dead by the Ansar Allah, after a missile attack?",Royal Saudi Air Force,hard,20
Are Grizzly Bear and Residual Kid both rock bands?,yes,medium,10
Paris By Night 83 is shot in an amusement park that features how many rides ?,35,medium,16
Which senator from Hawaii defeated Campbell Cavasso in the 2010 senate race and was the highest-ranking Japanese American politician in United States history?,Daniel Inouye,medium,24
"What is the birthdate of the person who released ""(Open Up the Door) Let the Good Times In"" in 1966?","June 7, 1917",medium,25
William Neville Hart was from the most senior royal palace in what country?,United Kingdom,medium,14
are Il re pastore and King Priam both Operas ?,yes,medium,10
When was the college Oklahoma Sooners men's basketball team represented founded?,1890,medium,13
The singer who released the 1986 album Girls Like Me was born in what year?,1958,medium,16
Nelson Pizarro was from the city in what Florida county?,Broward,medium,11
What is the capacity of the La Liga stadium in  which The Madrid Derby team plays their home games?,"68,000",hard,20
How many seasons was Tinker Owens' brother a running back in?,five,medium,13
"What drummer replaced Lee Kerslake as drummer for Ozzy Osbourne and go on to perform with Whitesnake, Ted Nugent, and Thin Lizzy as well?",Tommy Aldridge,medium,27
"Kendall Coyne was recognized as the recipient of the NCAA Today's Top 10 Award, which featured this Dallas Cowboys quarterback, born in what year, as one of the ten finalists",1993,medium,34
Palladio was a composition for a string orchestra it was the work in three movements called concerto grosso or also called what?,Motif,easy,23
What region of Italy did Giovanni Giarola paint in?,Emilia-Romagna,hard,10
"What book describing a plan for the occupation of Germany after WWII was written by Henry Mogrenthau Jr, US Secretary of the Treasury under President Franklin D. Roosevelt?",Germany is Our Problem,medium,30
Shirley Parish Church was the location where which English footballer was married?,Alan Shearer,medium,13
"Who was born earlier, Philippe Perrin or Sigmund Jähn?",Sigmund Werner Paul Jähn,medium,11
What is the name of the Montreal massacre that resulted in the creation of the Firearms Act 1995?,The École Polytechnique massacre,medium,19
"Located in a shipyard to the southeast corner of San Francisco, the USS Mahan was a ""Farragut""-class guided missile destroyer that was launched on what date?",7 October 1959,easy,31
Who was the loyal attendant of the president of the French Second Republic?,Henri Conneau,medium,14
Which ethnic group which Tonga people of Zambia and Zimbabwe belong inhabit a geographical area stretching east and southward from Central Africa across the African Great Lakes region down to Southern Africa?,Bantu peoples,hard,33
When was the ship that was the subject of a Donald Franklin Stewart directed museum built?,1854,hard,17
Which anime was David Lodge devolved in that was written and illustrated by Masashi Kishimoto?,Naruto,medium,16
One of the Gorr villains appearing in Marvel Comics inhabits the forests of which continent?,central Africa,easy,16
What do Joseph Kosinski and Harold Young have in common?,director,easy,11
The writer of the lyrics to the song Maria has won how many Grammy Awards?,eight,medium,16
"What is the former name of the only bank ine the village of Gar Munara, in Pakistan?",Habib Bank Limited,medium,19
