Question,Answer,Level,Question Length
"G3 is a concert tour organized by guitarist Joe Satriani featuring him alongside two other guitarists, include which English musician guitarist, best known as the lead guitarist of the rock band Queen?",Brian Harold May,easy,35
Studies in Mutualist Political Economy is a book on political economy published on 2007 by an author  anarchist and political theorist who graduated from what University in 1987?,University of Arkansas,medium,29
"The High Mountain Institute (HMI) is a non-profit educational organization located in Leadville, the statutory city that is the county seat, and only incorporated municipality, in Lake County, Colorado, in which country?",United States,easy,40
Who directed the film that Étienne Comar produced in 2010 ? ,"Xavier Beauvois,",hard,11
What is the nationality of the director of the controversial 2013 2013 internationally co-produced romantic drama film adaptation of a William Shakespeare play?,Italian,medium,24
During what athletics events in August 2004 were marathons ran from the site of the battle of Marathon in 490 BC to the Kallimarmaro Stadium?,2004 Summer Olympics,easy,26
"The Film-Makers' Cooperative a.k.a. he New American Cinema Group is an artist-run, non-profit organization founded in which year, in New York City by Jonas Mekas?",1962,easy,30
"Which movie came out first, A Christmas Carol or The Strongest Man in the World?",The Strongest Man in the World,medium,17
"Among India's oldest universities founded in 1918, Osmania University is in which city?",Hyderabad,medium,16
"One Manhattan Square and 35 Hudson Yards, are both located in which New York borough?",Manhattan,easy,17
What country of origin does Death Has a Shadow and Super Bowl XXXIII have in common?,American,hard,17
"The film ""Police Academy 6: City Under Siege"" stars a professional football player inducted into the College Football Hall of Fame in what year?",1988,medium,28
"Who was born first, Irwin Shaw or John Dunning?",Irwin Shaw,medium,11
"The harm principle, holds that the actions of individuals should only be limited to prevent harm to other individuals, who articulated this principle in which philosophical work, originally intended as a short essay?",John Stuart Mill,easy,37
"what is the 3112 acre Pennsylvania state park that took over 11,000 to make due to the wave action of lake Erie called?",Presque Isle,hard,24
The refuge for a historically significant herd of free-roaming Mustangs is close to what lake? ,Bighorn Lake,hard,16
"Where was the band that made the song ""Disarm"" formed?","Chicago, Illinois",medium,13
"Jesse Brock (born July 18, 1972, in Decatur, Illinois) is a bluegrass artist who plays the mandolin and supplies both lead and supporting vocals, he recorded and toured, and with which award-winning blind American bluegrass fiddle player?",Michael Cleveland,easy,45
"The king who was responsible for the Act of the 18th was in power until what year, the same year he died?",1377,hard,24
"Which singer on the single ""Pictures in the Dark"" was born 29 December 1970?",Aled Jones,medium,17
Mount Gushmore is an artificial hill in a water theme park located in which resort ?,the Walt Disney World Resort,medium,16
I Saw the Devil starred the actor who was in what critically-acclaimed 2015 film?,Inside Men,medium,15
"Of Myles Goodwyn and Justin Timberlake, which started his musical career earlier?",Justin Randall Timberlake,hard,14
"Transylvania 6-5000 (1963) is a ""Merrie Melodies"" animated short directed by Chuck Jones that stars this animated cartoon character created in 1940 by Leon Schlesinger Productions (later Warner Bros Cartoons) and voiced originally by Mel Blanc?",Bugs Bunny,easy,43
What are four stores that can be found in the mall near the 1-485/South Boulevard station?,"Sears, Belk, JCPenney, and Dillard's",medium,17
"Who published a book about Scandinavia by the author best known for ""A Vindication of the Rights of Woman""",Joseph Johnson,medium,21
Who invented the type of script used in autographs?,the Sumerians,medium,10
Boyne Mountain Resort's first chair lift was originally constructed for a resort located in what county?,Blaine County,medium,18
 Who was born first Lew Landers or Sherman Alexie?,Lew Landers,medium,10
Who wrote the novel that was the basis for the movie that Morfydd Clark played Frederica Vernon in?,Jane Austen,hard,19
"Who coined the term in ""The Wire"" of the music genre that follows from bedroom pop?",David Keenan,medium,19
Are both Elizabeth Jane Howard and Patrick White from the same country?,no,medium,13
"Jo Nesbø primary known for writing about a particular detective, who is it critic liken his personality to? ","Critics liken the personality of Harry Hole to those of the famous literary detectives: Sherlock Holmes, Hercule Poirot, Jules Maigret, and Nero Wolfe.",easy,20
What digital magazine and website for IT professionals in the United Kingdom recognized Mayank Prakash in their 2015 awards?,Computer Weekly,medium,20
Fred Mundee attended the public high school that was built in what year?,1909,medium,14
The Johann Strauss Orchestra has hosted which operatic soprano?,Carmen Monarcha,medium,10
In what country was the FIFA World Cup in which Miguel Guerrero played for Colombia held?,Italy,medium,17
"The Sia song ""ustoppable"" is on her album released on what date?",29 January 2016,medium,15
What is the birth date of the actor who plays the biological father in the movie Daddy's Home?,"June 5, 1971",medium,20
Who directed and co-produced the 2014 American biographical drama that Paul Edward Valentine Giamatti was in?,Bill Pohlad,medium,17
Are both PC Magazine and Kitelife magazines dedicated to computers?,no,hard,11
Which #2 ranked 125-pound female fighter and competitor in the Invicta Fighting Championships flyweight division did Barb Honchak defeat?,Vanessa Porto,medium,21
How many people died in the event that killed Eve Meyer?,583,medium,12
"What fictional DC Comic ""queen of the sea"" was voiced by actress Sirena Irwin?",Mera,medium,17
Smosh: The Movie included an appearance from the youtube personality from what Hawaii city?,Honolulu,medium,16
The University of Minnesota Armory was mainly used to house the basketball team that has played in what conference since 1905?,Big Ten,medium,22
Do both Dregea and Hepatica belong to the taxonomic category of genus?,yes,medium,13
Who is sometimes considered the author of the official national anthem of Bermuda?,John Bull,medium,14
"Who lived longer, Lazar Lyusternik or Mikhail Kravchuk?",Lazar Aronovich Lyusternik,medium,10
Which actress of the movie Havoc is daughter of John Phillips,Bijou Phillips,easy,11
"After which porn star was the main character modeled for 1997 film starring Mark Wahlberg, Julianne Moore, Burt Reynolds and others?",John Holmes,medium,24
Who co-founded Prospect Park and is also the CEO of The Firm in Santa Monica?,Jeff Kwatinetz,medium,16
"What episode was played first, Truth and Advertising or PC Principal Final Justice?",Truth and Advertising,hard,15
"Who did One Million Strong  have on it that was inducted into the Rock and Roll Hall of Fame on April 7,2017?",Tupac Shakur,medium,23
"This American poet, born in 1830, was the sister in law of Susan Huntington Gilbert Dickinson? ",Emily Dickinson,medium,19
How do retailers make up for losses due to shoplifting?,increase prices,medium,11
UFC Fight Night: Namajunas vs. VanZant was held at a luxury resort casino and hotel opened on what date?,"December 15, 2010",medium,21
"Who is half of a comedy duo that performed in the 2008 comedy tour Still Alive and also starred in the lead role in the sitcom ""The Vicar of Dibley?""",Dawn French,medium,33
"Which post-apocalyptic US film, also starring Will Smith, was Alice Braga's first major international role?",I Am Legend,hard,19
Which country was Dora Luz's work in The Three Caballeros premiered in? ,Mexico,medium,14
Mark Antony and Cleopatra and the Sergii family brothers participated in what battle?,Battle of Actium,medium,14
Leonard Johnson was the cornerback for what college football team who’s home field is the jack trice stadium? ,Iowa State Cyclones football,medium,21
How did  American sports comedy BASEketball star Jenny McCarthy begin her career in 1993?,"nude model for ""Playboy""",hard,15
"Which Nakhal group owned airline is based at an airport located located 9 km from the city center in the southern suburbs of Beirut, Lebanon?",Wings of Lebanon,medium,27
Blanche Hunt was the mother of what award winning character played by Anne Kirkbride?,Deirdre Barlow,hard,15
Who was the original artist of the song covered in Glen Campbell's 1967 video?,Johnny Rivers,medium,16
Are Craig Melville and Andrzej Wajda both film directors?,yes,medium,10
Ruth Monika Parasol is the largest stakeholder in which former largest publicly traded gamblig firm?,Bwin.Party Digital Entertainment,medium,16
What lunar module pilot was depicted in the 1995 film Apollo 13?,Fred Haise,medium,13
What is the name of the larger organization to which the ballet company Émilie Cozette performs in is a part of?,the Paris Opera,medium,22
Which city in Upper Austria did 2017 European Under-23 Baseball Championship hold,Wels,medium,12
Are the genuses Cyanotis and Syzygium both found in Africa?,yes,hard,11
Who developed the Mercedes-Benz T80 which was intended to break the world land speed record?,Ferdinand Porsche,medium,16
"Which American poet, painter, essayist, author, and playwright who wrote approximately 2,900 poems was published by Duell, Sloan and Pearce?",E. E. Cummings,hard,26
"Which band-mate of Joe Perry's co-wrote ""Monkey On My Back"" and is known as the ""Demon of Screamin""?",Steven Tyler,hard,24
Which village is just north of the A-road in Lincolnshire which runs between Wragby and Maltby le Marsh (approximately 26 mi)?,Strubby,medium,24
Encounter Books draws it names from a magazine founded in what year?,1953,medium,13
"Which seinen manga featuring Kei Kurono, and Masaru Kato, did Hiroya Oku write?",Hen,medium,16
S.Easwara Varma is a violinist who has accompanied an Indian vocalist who is one of ten musicians to receive the Madras Music Academy's Sangeetha Kalanidhi before they turned what?,50 years of age,hard,31
What movie did the artist who performed the Femme Fatale Tour star in?,Crossroads,hard,14
Who is the composer of the song that Friederike Grün was in who is a composer of the Romantic school?,Carl Maria von Weber,medium,21
Which of the following dog breeds was originally bred for hunting deer: Bloodhound or Catahoula Cur?,Bloodhound,medium,18
What is the name of the Korean hip-hop band that had an album that charted on Oricon at the 10th place?,Big Bang,medium,22
"What American-Canadian singer and actress was featured regularly on season three of ""Mighty Morphin Power Rangers"", as well as ""Felicity"", and ""Flashpoint""?",Amy Jo Johnson,medium,31
Is Xingtai and Linyi both from a province in China that borders each other?,yes,easy,15
On what date was the album Before REMIXXXX by You Say Party released?,"September 29, 2009",medium,14
"In between Blue Peter and Alanis Morissette who's album ""Supposed Former Infatuation Junkie"", was released in 1998?",Alanis Nadine Morissette,medium,22
Jack Del Rio was a lineback for how many NFL teams,four,easy,11
Which Swiss actress and opera director was in the film Time of the Wolf?,Marthe Keller,hard,15
"Which two activites are closely associated with a popular 2004 concept which spurred  the hoax claim, Toothing?",voyeurism and exhibitionism,easy,19
"In addition to Alice Faye, Fred Allen, Joan Davis, Marjorie Weaver and the individual born in December 1913, who else starred in Sally, Irene and Mary?",Gregory Ratoff,hard,32
When was the gurudwara situated in a second grade municipality in the Ramanathapuram district in the South Indian state of Tamil Nadu built?,1511,hard,24
Which sport in which Mira Rai consists of running and hiking over trails?,Trail running,medium,14
"Who was the wife of the German poet who wrote ""Die Lösung ""?",Helene Weigel,medium,15
"Name an organization to which Gene Autry's collaborator on ""Here Comes Santa Clause"" belongs. ",ASCAP,hard,18
What American comedian has been a magazine editor and has a video blog called JaHeRo on her website?,Rosie O'Donnell,medium,19
How many Royal families did Empress Matilda belong to?,24,medium,10
Do the bands Peter Bjorn and John and Shihad both play indie pop?,no,hard,14
Who are the two main characters of the animated Cartoon Network series that Boulder Media is best known for?,Mac and Bloo,hard,20
What film's score was composed by the same person who produced an album called The City?,Bitter Moon,medium,18
T. J. Watt is the brother of the fullback for which NFL team?,Los Angeles Chargers,medium,14
"Which director began making movies earlier, Richard Linklater or Arthur B. Woods?",Arthur Bickerstaffe Woods,medium,15
"What song did the Dutch singer that was a founding member of Within Temptation help write for the album ""The Silent Force""?","""Jillian (I'd Give My Heart)""",medium,25
"What ""Census"" conservation project did the group that backed Value America also fund?",the Great Elephant Census,medium,16
"What type of plants are Sinningia, named after Wilhelm Sinning, and Calla from the family Araceae?",flowering plants,easy,19
How many gatherings take place every Sunday at the church that Pascoe St Leger Grenfell donated an acre of land for?,four,hard,22
"Bombing Hitler's Dams is an episode on ""NOVA"" in which Hugh Hunt enlists the help of which family-run airline, based in Hay River, Northwest Territories, Canada, established in 1970? ",Buffalo Airways,easy,37
"Which rock band, Against Me! or Unrest, was one of Mark Robinson's projects for what would eventually become the TeenBeat label?",Unrest,easy,26
"Actor Steve Byers is best known for his roles on ""Falcon Beach"" and a series created by who?",Aaron Martin,medium,21
The 2010 FA Community Shield included Manchester United goals by the right winger and right-back of what nationality?,Ecuadorian,medium,19
Who built the resort that Kathy Griffin recorded Look at My Butt Crack at?,developer Steve Wynn,hard,15
"Which city has a higher population, Xinzheng or Tianshui?",Tianshui,medium,11
Book of Dragons was released along with the short film that was directed by whom?,Tom Owens,medium,16
"Which university is the third-largest university campus in the United States, Indiana University or Ohio State University?",Ohio State University,medium,19
The State Fair Classic occurs before what game commonly called the Red River Rivalry?,Red River Showdown,easy,15
"What was the nickname of the man who wrote ""A Soldier's Story""?","""Brad""",medium,16
"Fritz André played for Haiti in what tournament, held in West Germany in 1974?",The 1974 FIFA World Cup,medium,16
Which former president of the of the Indiana Pacers organization helped to turn around the Boston Celtics 1979-80 season?,Larry Bird,medium,20
"Nine players have won the Crystal Palace F.C. Player of the Year award twice, including what footballer who plays as a winger for Premier League club Crystal Palace and the Ivory Coast national team? ",Dazet Wilfried Armel Zaha,medium,37
Which realm was passed onto this duke whose father passed away before his birth and whose history was documented in the memoirs of Helene Kottanner?,Estates of Austria,hard,26
The journal Progress in Polymer Science is published and edited at which Pittsburgh university?,Carnegie Mellon University,medium,15
Frank Dean Lucas's congressional district stretches from the edge of Tulsa to what other state's border?,Oklahoma Panhandle,hard,19
"Which film director was born first, John English or Jason Reitman?",John Wilkinson English,medium,13
"Who is an French film maker, Jean-Pierre Melville or Christopher Nolan?",Jean-Pierre Melville,medium,13
"Love Drunk is the second studio album recorded by rock/pop band Boys Like Girls, which song featuring Taylor Swift, from their second studio album ""Love Drunk"" in 2009?",Two Is Better Than One,easy,33
"what  American Wrestling Association wrestler was known by his ring name ""The Fish""",Gilles Poisson,hard,15
The January 2015 Kolofata raid was perpetrated by the extremist group based in what country?,Nigeria,medium,16
How many impromptu locations did Paul McCartney go to promote his fourteenth solo album?,six,medium,15
"Who attended the same school as Yuen Biao in Shanghai, Shanghai?","Peking Opera School ""brothers"" at the ""China Drama Academy"", Sammo Hung and Jackie Chan",hard,13
The head coach at Mississippi State University from 1954-1955 won a share in the Southwest Conference championship in what year?,1959,easy,21
Which actress was the mother of the man who provided text for the narrated portions of the comic ballet Punch and the Judy?,Dame Ellen Terry,medium,24
This 1996-1997 BBL season  shares the name of  what type of drink which is produced by Anheuser-Busch?,an American-style pale lager,hard,18
KUWR is owned by the college located in what city?,"Laramie, Wyoming",medium,11
Colin Vaines is a film and Emmy-winning television producer whose credits include a 2011 British film staring the directorial debut of who?,Ralph Fiennes,medium,23
"which title that has been created twice, once in the Peerage of England and once in the Peerage of the United Kingdom did its family owned Exeter House",Marquess of Exeter,medium,29
From which country was the explorer who discovered the island of Manhattan?,was an English sea explorer and navigator during the early 17th century,easy,13
What university did the footballing legend whose career was launched by Bank Tejarat F.C. attend?,Sharif University of Technology,medium,17
Denethor appears in a fictional novel that began as a sequel to what novel?,The Hobbit,medium,15
"What heavyweight champion nicknamed ""The Manassa Mauler"" starred in Daredevil Jack?",Jack Dempsey,easy,14
"Which tributary near Meyerstown, West Virginia has two forks approximately 100 mi long each",Shenandoah River,medium,15
"What is the  large marine bivalve mollusc species with the scientific name ""Panopea generosa""?",Geoduck,hard,17
"Which genus contains more species, Bursera or Xanthoceras?",Bursera,medium,10
Do Derek Jarman and Joseph Ruben have the same nationality?,no,medium,11
"What type of specialist school is the lead member of the seven academy schools in Lincolnshire, England?","science, technology and teaching",hard,19
What English former football forward paraded trophies along with Alan Ball and Ray Wilson before the 1966 FA Charity Shield?,Roger Hunt,medium,21
"In what film was the first leading role for Amber Heard, who had a small role in Nick Cassavetes' 2006 crime film?",All the Boys Love Mandy Lane,medium,25
What year was the university system that the University of Montana is a part of created?,1994,medium,17
"Which is generally considered an introduced species, Centranthus  or Arabis?",Centranthus,medium,12
Jourdan Miller won the the twentieth cycle of a reality tv show created by who?,Tyra Banks,medium,16
Terrible Beauty was a novel by the politician who serves what district in New York?,2 congressional district,medium,16
Are the films Finders Keepers and Why We Fight different genres?,no,hard,12
What do Der junge Lord and Giasone have in common?,an opera,medium,11
The 1994 Eastern Michigan Eagles football team had a head coach born in what year?,1962,medium,16
"Which English poet, painter, and printmaker wrote the poetry on which Tangerine Dream based the lyrics of its thirty-first album?",William Blake,medium,23
Rich Christiano and Michel Boisrond were born in which months?,October,medium,11
"The Cortex System is a generic RPG system based on the ""Sovereign Stone System "", and was developed by Margaret Weis Productions, Ltd for the Serenity Role Playing Game, a science fiction role-playing game released in which year, and set in the universe of the movie ""Serenity""?",2005,easy,55
"Robert F. Hughes, an American television director, worked on what American animated television series from the creators of ""Phineas and Ferb""?",Milo Murphy's Law,hard,26
Who directed the film where Jared Van Snellenberg played a caddy?,Dennis Dugan,medium,12
What is the date of birth of the host of Loveline after the show was rebooted?,"October 21, 1983",hard,17
"Q: What venue, also called the ""Convent Garden,"" did Adrian Boult conduct for?",The Royal Opera House,medium,19
"In 1903, a Great Plains native American tribe brought a case against the government, what was the case named?",Lone Wolf v. Hitchcock,medium,22
"Purple Rain is a song by Prince and The Revolution, it reached number 2 in the United States for how long, behind Wake Me Up Before You Go-Go, a song by the British duo Wham!?",two weeks,easy,40
Which one of Canada's three Maritime provinces is The Back Bay Formation  a geologic formation in,New Brunswick,hard,17
A Vampire Diaries star received an award for raising animal issues awareness given annually by which organization?,Humane Society,medium,18
"Who was born first, Minoru Niihara or Luna?",Minoru Niihara,medium,10
Taehoon Oh is a lead artist and was one of the pioneer developers of a game that began on which console ?,Microsoft Windows,hard,22
"Between Shawn Efran and Stephen Hopkins which is the more ""decorated"" in their respective careers?",Shawn Efran,medium,18
Who sang the theme song for a British comedy-drama television programme about seven British migrant construction workers?,Gary Holton,medium,18
Which basketball conference doe the team formerly coached by Burton Shipley currently belong to?,Big Ten Conference,medium,15
"When does the singer of ""Get Thy Bearings"" born?",10 May 1946,medium,12
"Nikhil Mathew won a chance to sing a song for music director Harris Jayaraj - ""Enadhuyire"" along with an Indian playback singer and the founder and CEO of a company called what?",Blue Elephant,medium,35
The Parent Trap originally starred which younger sister of Juliet Mills?,Hayley Catherine Rose Vivien Mills,medium,12
Were Thomas Berger and H. L. Davis thought to be underappreciated?,no,medium,12
Who is the husband of the female star of the film Showdown ?,Alex Karras,medium,13
The Washington Monthly and Electronic Design are both made in what Country?,USA,hard,13
Sophia B. Jones was the founder of the nursing program at a college located in which US state ?,Georgia,medium,19
Which Argentinian Province capital was on the Andean Railway line built towards the end of the 19th century?,San Luis,medium,19
"Hiwassee Dam is the third highest dam in the TVA system, behind Watauga and a hydroelectric dam on what river?",Little Tennessee River,medium,22
"Which South Korean horror film series is noted as helping to generate the explosion of the New Korean Wave cinematic movement containing movies like ""Wishing Stairs""?",Whispering Corridors,medium,29
The president of the Rehearsal Club came into royalty because of his marriage to which person?,Princess Helena,medium,17
The music video of the song Hey Porsche features a car produced by which company ?,Porsche Konstruktionen GesmbH,medium,16
"Which band has six consecutive number one albums, Army of Anyone or Dave Matthews Band?",Dave Matthews Band,hard,17
What is the name of the class guided missile destroyer named for the female who was a pioneer of computer programming responsible for inventing one of the first compiler related tools?,"USS ""Hopper""",hard,32
LKS Pogoń Lwów is a former Polish professional sports club which existed from 1904 until the outbreak of a war that lasted until what year?,1945,medium,26
"Which star of Now You See Me 2 was born on July 23, 1961 ?",Woody Harrelson,medium,16
"who was from Columbus, Howlin Maggie or Kevin Devine?",Howlin' Maggie,easy,11
5 Fingers included the James Mason character who was based on the secret agent for which group?,Nazi Germany,medium,18
"What came first, Honda Today or Honda City?",Honda City,medium,10
Which basketball player is the older son of the head coach of Vytautas Prienai-Birštonas of the Lithuanian Basketball League (LKL)?,Domantas Šeskus,easy,23
Bubble Wrap is made by the company that also makes what type of food packaging?,Cryovac,medium,16
"Which UK chart topping single came first, John Newman's ""Blame"" featuring Calvin Harris or ""I'm Not Alone"" by Calvin Harris?","""I'm Not Alone""",medium,28
"Sylva Kelegian and Lisa Rose Apramian, have which nationality?",Armenian-American,easy,11
"The commerce of Zuber, Florida is supported by its proximity to an interstate that has what speed limit for its entire length in Florida?",70 mph,medium,26
How many districts are there in the region of Ghana where the Lawra-Nandom constituency resides?,nine (9) districts,hard,16
By what name are tall buildings often referred; examples being 10 East 40th Street and Olympic Tower both situated in New York City?,skyscraper,easy,25
"Laurens Vanthoor, is a Belgian professional racing driver, born on which date, currently racing for Porsche Motorsport, has been successful in many branches of motorsport of which most have been in long distance races?",8 May 1991,easy,39
"Which English actor known for her performance as Queen Elizabeth II in ""The Queen"" starred in ""The Cook, the Theif, His Wife & Her Lover""?",Helen Mirren,medium,32
Sosarme was written by this German and later British composer who became a naturalized British subject in what year?,1727,hard,20
Charles Williams went to what school that was founded in 1855?,Berea College,medium,12
"Kevin Gentry is a conservative political activist and fundraiser who serves as vice president of the Charles G. Koch Charitable Foundation, Gentry serves as vice president of special projects at Koch Industries, an American multinational corporation based in Wichita, Kansas, in which country?",United States,easy,48
What franchise are both Christopher Nolan and John Nolan known for?,Batman,easy,12
